user_id,retweet_count,retweeted,favorite_count,text,hashtags,mentions,created_at,created_str
3080829096.0,0.0,False,0.0,"Tumult over rules, condemnation of Clinton at GOP convention",[],[],1468892288000.0,2016-07-19 01:38:08
3080829096.0,0.0,False,0.0,Cleveland Prepares For Mass Arrests During GOP Convention https://t.co/xDS289EaQC | https://t.co/atnBCOI2PT https://t.co/zfhQVV1Ghe,[],[],1468940173000.0,2016-07-19 14:56:13
3080829096.0,0.0,False,0.0,Jesse Williams Just Won The Melania Trump Hashtag Game https://t.co/pxZP6LrVat | https://t.co/atnBCOI2PT https://t.co/GkiYWFq9QF,[],[],1469004990000.0,2016-07-20 08:56:30
3080829096.0,0.0,False,0.0,Local student with Cerebral Palsy to cover POTUS debate https://t.co/tJDYEhjWpX | https://t.co/atnBCOI2PT,[],[],1471552406000.0,2016-08-18 20:33:26
3080829096.0,0.0,False,0.0,Naked Donald Trump statues pop up in cities across the US,[],[],1471558760000.0,2016-08-18 22:19:20
3080829096.0,0.0,False,0.0,"Donald Trump, Ryan Lochte and the politics of contrition",[],[],1471699434000.0,2016-08-20 13:23:54
3080829096.0,0.0,False,0.0,Donald Trump to stop in Fredericksburg Saturday https://t.co/h3F4nXEXhn,[],[],1471700568000.0,2016-08-20 13:42:48
3080829096.0,0.0,False,0.0,"Donald Trump, Stafford Sheriff Decatur meet to discuss law enforcement issues https://t.co/km5ccrd0Uv",[],[],1471736999000.0,2016-08-20 23:49:59
3080829096.0,0.0,False,0.0,Trump in Virginia: We are 'the Party of Lincoln' https://t.co/3gl8gRhWo7,[],[],1471750714000.0,2016-08-21 03:38:34
3080829096.0,0.0,False,0.0,Trump supporters show for Fredericksburg rally https://t.co/9Nnq2MlHBJ | https://t.co/atnBCOI2PT,[],[],1471833201000.0,2016-08-22 02:33:21
3080829096.0,0.0,False,0.0,"Back in Washington, Obama’s vacation glow may fade quickly",[],[],1471868575000.0,2016-08-22 12:22:55
3080829096.0,0.0,False,0.0,Judge in Texas temporarily blocks Obama’s transgender rules,[],[],1471873689000.0,2016-08-22 13:48:09
3080829096.0,0.0,False,0.0,Donald Trump's Presidential Candidacy In One Easy-To-Follow... https://t.co/HpU3rGkNIq | https://t.co/atnBCOI2PT https://t.co/3vPNRcdPbA,[],[],1471983565000.0,2016-08-23 20:19:25
3080829096.0,0.0,False,0.0,Mike Pence LOL'd At Trump's Absurd Claim To Win Black Voters https://t.co/XHpxQvNn7e | https://t.co/atnBCOI2PT https://t.co/FPy4XXdsmm,[],[],1472027419000.0,2016-08-24 08:30:19
3080829096.0,0.0,False,0.0,GOP Senator Still Thinks Efforts To End Housing Discriminat... https://t.co/jqSHTRFInu | https://t.co/atnBCOI2PT https://t.co/zom2HtwXpw,[],[],1472162559000.0,2016-08-25 22:02:39
3080829096.0,0.0,False,0.0,Henrico Senator on Trump's African-American outreach: 'We're not stupid' https://t.co/pchPBBwLbt,[],[],1472177906000.0,2016-08-26 02:18:26
3080829096.0,0.0,False,0.0,Trump compared to Harry Potter villain in UPenn Prof's study https://t.co/Z6JmKy7hcf | https://t.co/atnBCOqrYl https://t.co/iSoSo9kZZh,[],[],1472182818000.0,2016-08-26 03:40:18
3080829096.0,0.0,False,0.0,Virginia KKK group ‘sets record straight’ on Trump remarks https://t.co/2WKiQgQFYu,[],[],1472270679000.0,2016-08-27 04:04:39
3080829096.0,0.0,False,0.0,"Yep, Donald Trump Was Once Popular Among African-Americans https://t.co/QoQiLxMMUC | https://t.co/atnBCOqrYl https://t.co/KQSfBSXVcU",[],[],1472289126000.0,2016-08-27 09:12:06
3080829096.0,0.0,False,0.0,What Portraying Michelle Obama Taught Tika Sumpter About Em... https://t.co/YC8o8R0ys6 | https://t.co/atnBCOqrYl https://t.co/sKlghuSOTa,[],[],1472398221000.0,2016-08-28 15:30:21
3080829096.0,0.0,False,0.0,Donald Trump Suggests Colin Kaepernick 'Find A New Country'... https://t.co/vryFNPAW47 | https://t.co/atnBCOI2PT https://t.co/Ck65T4XeXn,[],[],1472571201000.0,2016-08-30 15:33:21
3080829096.0,1.0,False,0.0,"State Officials Discuss Polls, Ballot Ahead of Election Day https://t.co/xrx09C62MB",[],[],1472603635000.0,2016-08-31 00:33:55
3080829096.0,0.0,False,0.0,Trump Surrogate Questions MSNBC Host’s Ancestry While Defen... https://t.co/2uhzpEoLsX | https://t.co/atnBCOqrYl https://t.co/coimoKbF7J,[],[],1472635997000.0,2016-08-31 09:33:17
3080829096.0,0.0,False,0.0,"Venturing to Mexico, Trump defends right to build huge wall https://t.co/T5O50O5QQq",[],[],1472684417000.0,2016-08-31 23:00:17
3080829096.0,0.0,False,0.0,Trump vows to remove millions living in country illegally https://t.co/wos33A3Qe4,[],[],1472705941000.0,2016-09-01 04:59:01
3080829096.0,0.0,False,0.0,David Duke And His Pals Loved Trump's Immigration Speech https://t.co/wpMJYZz7FN | https://t.co/atnBCOI2PT https://t.co/7zKPF7foFG,[],[],1472745247000.0,2016-09-01 15:54:07
3080829096.0,1.0,False,0.0,FBI publishes notes on Clinton's use of private email https://t.co/pRxUydiwxH,[],[],1472846231000.0,2016-09-02 19:57:11
3080829096.0,0.0,False,0.0,Donald Trump will be in VA Beach Tuesday for campaign event https://t.co/pTaDZaTRd3,[],[],1472936152000.0,2016-09-03 20:55:52
3080829096.0,0.0,False,0.0,Trump tells black churchgoers in Detroit visit is 'to learn' https://t.co/t6DgbHOJ5O,[],[],1472961385000.0,2016-09-04 03:56:25
3080829096.0,0.0,False,0.0,Trump Met With A Few Black Leaders In Philadelphia. The Pub... https://t.co/1DabIs0jRB | https://t.co/atnBCOI2PT https://t.co/o7U457DP8f,[],[],1472982803000.0,2016-09-04 09:53:23
3080829096.0,0.0,False,0.0,This May Be Donald Trump's Most Shameless 'Pivot' Yet https://t.co/SDUE45qYvT | https://t.co/atnBCOI2PT https://t.co/5gZ1nPFMKP,[],[],1473004388000.0,2016-09-04 15:53:08
3080829096.0,0.0,False,0.0,At Least A Few Black Churchgoers Liked Donald Trump’s Detro... https://t.co/TXfH0BI2nq | https://t.co/atnBCOI2PT https://t.co/crugyUK8Ja,[],[],1473069183000.0,2016-09-05 09:53:03
3080829096.0,0.0,False,0.0,Obama says he understands Kaepernick’s protest,[],[],1473085721000.0,2016-09-05 14:28:41
3080829096.0,0.0,False,0.0,Obama cancels meeting with new Philippine President Duterte https://t.co/L4OtFcXvoz,[],[],1473131032000.0,2016-09-06 03:03:52
3080829096.0,0.0,False,0.0,Obama cancels meeting with new Philippine president https://t.co/KnlhSuZnQ1,[],[],1473136055000.0,2016-09-06 04:27:35
3080829096.0,0.0,False,0.0,Obama vows to work to tighten sanction on North Korea https://t.co/Ldg521ChAO,[],[],1473163242000.0,2016-09-06 12:00:42
3080829096.0,0.0,False,0.0,Obama vows to work to tighten sanctions on North Korea https://t.co/mNdSSwL9rD,[],[],1473168401000.0,2016-09-06 13:26:41
3080829096.0,0.0,False,0.0,"Trump, Clinton not planning to campaign on 9/11 https://t.co/cs1PNfsljw | https://t.co/atnBCOI2PT https://t.co/ORccZYyMkL",[],[],1473218230000.0,2016-09-07 03:17:10
3080829096.0,0.0,False,0.0,Baseball Icon David Ortiz Slams Trump For Anti-Mexican Attacks https://t.co/HFcMLbLinu | https://t.co/atnBCOqrYl https://t.co/8sivH7NJtK,[],[],1473241636000.0,2016-09-07 09:47:16
3080829096.0,0.0,False,0.0,'The Daily Show' Dissects Donald Trump's Attempts To Win Black ... https://t.co/6vW6m3lR5p | https://t.co/atnBCOI2PT https://t.co/Tn8ApDbnvp,[],[],1473263240000.0,2016-09-07 15:47:20
3080829096.0,0.0,False,0.0,"Richmond-area veterans react to Clinton, Trump remarks during vet's forum https://t.co/zVp6vmcAsP",[],[],1473308759000.0,2016-09-08 04:25:59
3080829096.0,0.0,False,0.0,Comey defends Clinton private email server investigation in FBI... https://t.co/K34fQ6LdaF | https://t.co/atnBCOI2PT https://t.co/d8swYTn6Vb,[],[],1473325583000.0,2016-09-08 09:06:23
3080829096.0,1.0,False,0.0,Bill Clinton Says 'Make America Great Again' Is Just A Racist D... https://t.co/66mF4DC7PA | https://t.co/atnBCOI2PT https://t.co/jA5k3fTvux,[],[],1473349864000.0,2016-09-08 15:51:04
3080829096.0,0.0,False,0.0,Protesters outside Kaine's RVA church: 'He is a Catholic in grave error' https://t.co/qadCJ5ekcq,[],[],1473388560000.0,2016-09-09 02:36:00
3080829096.0,0.0,False,0.0,"Sen. Tim Kaine stops in Richmond while Gov. Mike Pence campaigns in Paris, Virginia",[],[],1473606388000.0,2016-09-11 15:06:28
3080829096.0,0.0,False,0.0,Hillary Clinton leaves 9/11 event because she wasn't feeling well https://t.co/cXI2yQIMeY,[],[],1473608593000.0,2016-09-11 15:43:13
3080829096.0,0.0,False,0.0,"Pence, Kaine Campaign in Virginia https://t.co/0cQbp2Fvvw",[],[],1473645155000.0,2016-09-12 01:52:35
3080829096.0,0.0,False,0.0,Leaked Colin Powell emails show loathing for Trump https://t.co/O45z7PWAhC,[],[],1473860754000.0,2016-09-14 13:45:54
3080829096.0,0.0,False,0.0,Leaked Colin Powell emails fault Trump and Clinton https://t.co/dwarehEnri,[],[],1473864849000.0,2016-09-14 14:54:09
3080829096.0,0.0,False,0.0,"Colin Powell Thinks Donald Trump Is A 'National Disgrace,' Le... https://t.co/J4PuVUafIj | https://t.co/atnBCOI2PT https://t.co/epwpVVEbF3",[],[],1473887044000.0,2016-09-14 21:04:04
3080829096.0,0.0,False,0.0,"In leaked emails, Powell calls Trump a 'national disgrace' https://t.co/wQF2Q9XSYO",[],[],1473888622000.0,2016-09-14 21:30:22
3080829096.0,0.0,False,0.0,Warner and Kaine Praise Water Infrastructure Bill https://t.co/50DUFJnb0H,[],[],1473964303000.0,2016-09-15 18:31:43
3080829096.0,0.0,False,0.0,Alan Cumming: Trump Allows People To Espouse Views They'd Oth... https://t.co/hLDlUeP87w | https://t.co/atnBCOI2PT https://t.co/SghRoxq539,[],[],1474016660000.0,2016-09-16 09:04:20
3080829096.0,0.0,False,0.0,Michelle Obama slams those who question her… https://t.co/YsCzBRmTzD | https://t.co/atnBCOI2PT,[],[],1474146543000.0,2016-09-17 21:09:03
3080829096.0,0.0,False,0.0,It Looks Like Donald Trump Is Done Talking About Birther Stuff https://t.co/Xpg1wj1tbF | https://t.co/atnBCOI2PT https://t.co/gvbgyEByLF,[],[],1474167851000.0,2016-09-18 03:04:11
3080829096.0,0.0,False,0.0,"Students Share Why They'll Miss Michelle Obama, 'America's Se... https://t.co/uPNUgVJJBn | https://t.co/atnBCOI2PT https://t.co/JRJfj2HRHt",[],[],1474189458000.0,2016-09-18 09:04:18
3080829096.0,0.0,False,0.0,Obama: Low Turnout By Black Voters Would Be 'A Personal Insult' https://t.co/dTYFtZyAbi | https://t.co/atnBCOI2PT https://t.co/7IeaG1ZyDs,[],[],1474211062000.0,2016-09-18 15:04:22
3080829096.0,0.0,False,0.0,Vice presidential candidate Mike Pence returns to Virginia for rally https://t.co/YkWn2w9upg,[],[],1474221260000.0,2016-09-18 17:54:20
3080829096.0,0.0,False,0.0,Trump Super PAC Strategist Says There Is An 'Otherness' To Obama https://t.co/f2HkKMA9qx | https://t.co/atnBCOI2PT https://t.co/ZTEwpx0t4D,[],[],1474232643000.0,2016-09-18 21:04:03
3080829096.0,2.0,False,1.0,Hillary Clinton Speaks 'Directly To White People' After Lates... https://t.co/n0UPvrdEZj | https://t.co/atnBCOI2PT https://t.co/Uo9FlrJqfB,[],[],1474427054000.0,2016-09-21 03:04:14
3080829096.0,0.0,False,0.0,"Donald Trump, Forgetting Slavery And Jim Crow, Claims Black A... https://t.co/2X41JFEBbt | https://t.co/atnBCOI2PT https://t.co/uhBbZXN3VA",[],[],1474471691000.0,2016-09-21 15:28:11
3080829096.0,0.0,False,0.0,"Virginia delegate facing multiple charges of assault, injury to child",[],[],1474581084000.0,2016-09-22 21:51:24
3080829096.0,0.0,False,0.0,Mike Pence Says We Shouldn't Talk About Racial Bias In The Wake Of Police Shootings https://t.co/rV8y4HSx28 https://t.co/L8QBDIMhFx,[],[],1474624396000.0,2016-09-23 09:53:16
3080829096.0,0.0,False,0.0,Obama vetoes 9/11 bill; possible override by Congress looms https://t.co/o1O16fJMJc,[],[],1474677321000.0,2016-09-24 00:35:21
3080829096.0,0.0,False,0.0,Russell Simmons: Donald Trump Is The Epitome Of White Supremacy https://t.co/sajIkDQvdl https://t.co/SK7xfqe9oX,[],[],1474689191000.0,2016-09-24 03:53:11
3080829096.0,0.0,False,0.0,Bill Maher Slams Donald Trump For Blaming Charlotte Protests On Drugs https://t.co/HLsVz6jgyi https://t.co/pValTaLRZD,[],[],1474818799000.0,2016-09-25 15:53:19
3080829096.0,0.0,False,0.0,Barack Obama Advises His 2009 Self In Hilarious Jimmy Fallon Clip https://t.co/0T0gYbjbCt https://t.co/XwpfTlpwCl,[],[],1474840403000.0,2016-09-25 21:53:23
3080829096.0,0.0,False,0.0,George W. Bush Interrupted Obama To Ask Him To Snap A Picture Of Him And It Was Amazing https://t.co/0euFgr2rMH https://t.co/UjWXTHfSVm,[],[],1474861986000.0,2016-09-26 03:53:06
3080829096.0,0.0,False,0.0,Poll: Clinton Has Strong Lead Over Trump in Virginia https://t.co/xiSoccnK4t,[],[],1474906048000.0,2016-09-26 16:07:28
3080829096.0,0.0,False,0.0,Civil Rights Museum Rejects Donald Trump's VIP Visit Request https://t.co/SVD9QD1LMR https://t.co/QY2gcYdgdX,[],[],1474926802000.0,2016-09-26 21:53:22
3080829096.0,0.0,False,0.0,"Clinton, Trump poised for must-see debate showdown",[],[],1474937930000.0,2016-09-27 00:58:50
3080829096.0,0.0,False,0.0,All The Dumb Things Trump Said About Race At The First Debate https://t.co/yLqznuyRu9 https://t.co/dlB8pngG40,[],[],1474968387000.0,2016-09-27 09:26:27
3080829096.0,0.0,False,0.0,Of Course Men Commented On Hillary Clinton's Looks During The Debate https://t.co/SSEkJjETrH https://t.co/VZ0PVWczZ6,[],[],1474969579000.0,2016-09-27 09:46:19
3080829096.0,1.0,False,0.0,Franchesca Ramsey's Retirement Home For Trump Fans Is Brilliant https://t.co/9TK3ujJJqS https://t.co/Ai7tFwi2AN,[],[],1474991189000.0,2016-09-27 15:46:29
3080829096.0,0.0,False,0.0,"Loudoun County weighs in on first Clinton, Trump debate https://t.co/rZD8W1KXnd",[],[],1475010384000.0,2016-09-27 21:06:24
3080829096.0,0.0,False,0.0,Driver uses cardboard Trump head in carpool lane https://t.co/CECZ1pwDHE,[],[],1475020085000.0,2016-09-27 23:48:05
3080829096.0,0.0,False,0.0,Report: Former Republican Senator John Warner to endorse Clinton https://t.co/Oq4TodJroq,[],[],1475026887000.0,2016-09-28 01:41:27
3080829096.0,0.0,False,0.0,Judge Blocks Some Voter Registrations On Election Day In Illinois https://t.co/7edR4Hibu7 https://t.co/X6aWFtKNnU,[],[],1475034364000.0,2016-09-28 03:46:04
3080829096.0,0.0,False,0.0,President Obama will be at Fort Lee for town hall meeting https://t.co/vHNEpoRe0u,[],[],1475060298000.0,2016-09-28 10:58:18
3080829096.0,0.0,False,0.0,"Congress rebukes Obama, overrides veto of 9/11 legislation https://t.co/DwS33I9F3V",[],[],1475102874000.0,2016-09-28 22:47:54
3080829096.0,0.0,False,0.0,"Former Virginia GOP Senator John Warner Endorses Clinton, Kaine https://t.co/u9ZgLODbj8",[],[],1475104742000.0,2016-09-28 23:19:02
3080829096.0,0.0,False,0.0,"Obama Hopes Military Members, National Anthem Protesters Will Consider Each Others' Pain https://t.co/XoS9h3StIh https://t.co/RCG2tHW2ij",[],[],1475119804000.0,2016-09-29 03:30:04
3080829096.0,0.0,False,0.0,This May Be The Most Horrible Thing That Donald Trump Believes https://t.co/08BzCiESUB https://t.co/lrnWZBFpxO,[],[],1475141411000.0,2016-09-29 09:30:11
3080829096.0,0.0,False,0.0,Former Va. Senator John Warner endorses Hillary Clinton https://t.co/uqb6ipZmK0,[],[],1475207664000.0,2016-09-30 03:54:24
3080829096.0,0.0,False,0.0,Pennsylvania Mayor Posts Racist Meme About Lynching President Obama https://t.co/RkwohINalN https://t.co/yZrbGm8mYr,[],[],1475228831000.0,2016-09-30 09:47:11
3080829096.0,0.0,False,0.0,"Clinton, Trump brace for the ‘SNL’ factor",[],[],1475264152000.0,2016-09-30 19:35:52
3080829096.0,0.0,False,0.0,"Henrico lawyers sought +$4 million in Trump lawsuit, alleged defamation https://t.co/tQFqMbWP7y",[],[],1475288555000.0,2016-10-01 02:22:35
3080829096.0,0.0,False,0.0,Donald Trump Doesn't Seem To Have A Clue How To Appeal To Millennials https://t.co/GDvtlf6TI3 https://t.co/905MaHOfcl,[],[],1475355784000.0,2016-10-01 21:03:04
3080829096.0,0.0,False,0.0,Alec Baldwin Slays With Hilarious Donald Trump Impression On 'SNL' https://t.co/OOfftlisGn https://t.co/aBP9hEZ8YJ,[],[],1475398994000.0,2016-10-02 09:03:14
3080829096.0,0.0,False,0.0,"Christie, Giuliani: If Trump didn't pay taxes, he's 'genius' https://t.co/rwqX50oVHX",[],[],1475435529000.0,2016-10-02 19:12:09
3080829096.0,1.0,False,0.0,Trump's new DC hotel vandalized with spray-painted graffiti https://t.co/qHy0xMeUx3 https://t.co/2crZoVsXYf,[],[],1475442381000.0,2016-10-02 21:06:21
3080829096.0,0.0,False,0.0,Trump’s new DC hotel vandalized with spray-painted graffiti,[],[],1475444065000.0,2016-10-02 21:34:25
3080829096.0,0.0,False,0.0,Survey: Clinton Increases Lead Over Trump in Virginia https://t.co/TfrwepMtOs,[],[],1475511078000.0,2016-10-03 16:11:18
3080829096.0,0.0,False,0.0,"Pence talks jobs, tax cuts, in Ashland rally https://t.co/ukQSRQlIhP",[],[],1475548816000.0,2016-10-04 02:40:16
3080829096.0,0.0,False,0.0,Rev. Jesse Jackson to campaign for Clinton at VCU https://t.co/2qdLaaybfq,[],[],1475580712000.0,2016-10-04 11:31:52
3080829096.0,0.0,False,0.0,Kaine and Pence Set to Debate in Farmville https://t.co/xUlIL1ALt9,[],[],1475617328000.0,2016-10-04 21:42:08
3080829096.0,0.0,False,0.0,Vice Presidential Candidates Kaine and Pence Debate in Farmville https://t.co/amTLsIHNFr,[],[],1475666987000.0,2016-10-05 11:29:47
3080829096.0,0.0,False,0.0,Poll Highlights Important Election Issues for Various Race https://t.co/zDHJzq0RYF,[],[],1475710284000.0,2016-10-05 23:31:24
3080829096.0,0.0,False,0.0,Lawmakers to Hold Meting to Discuss Upcoming Election https://t.co/88qntNSi1i,[],[],1475849856000.0,2016-10-07 14:17:36
3080829096.0,0.0,False,0.0,Lawmakers to Hold Meeting to Discuss Upcoming Election https://t.co/E7mu97Jtzt,[],[],1475861683000.0,2016-10-07 17:34:43
3080829096.0,0.0,False,0.0,"Awkward in the spotlight, Kaine a hit with donors in private https://t.co/yRpSypPjSO",[],[],1475867998000.0,2016-10-07 19:19:58
3080829096.0,0.0,False,0.0,Republicans reeling after Trump's vulgar comments revealed https://t.co/vuu8WRafTM,[],[],1475936737000.0,2016-10-08 14:25:37
3080829096.0,4.0,False,1.0,Trump dismisses GOP calls to quit race: 'Never' https://t.co/NBUSFoJHbj,[],[],1475946823000.0,2016-10-08 17:13:43
3080829096.0,1.0,False,1.0,"Republicans tell Trump to quit, billionaire vows to press on https://t.co/iC5EdwlsyG",[],[],1475969342000.0,2016-10-08 23:29:02
3080829096.0,0.0,False,0.0,Former Trump Va. chair: Trump comments 'male bravado' https://t.co/plHYCLTBv9,[],[],1476329388000.0,2016-10-13 03:29:48
3080829096.0,0.0,False,0.0,New allegations of sexual assault emerge against Trump https://t.co/nhCSVgKWYF,[],[],1476350739000.0,2016-10-13 09:25:39
3080829096.0,0.0,False,0.0,A look at hacked emails from Clinton's campaign chairman https://t.co/twY2u0isfx,[],[],1476568139000.0,2016-10-15 21:48:59
3080829096.0,0.0,False,0.0,"Clinton holds 15-point advantage in VA, according to latest poll https://t.co/IpD4wsxfGO",[],[],1476628405000.0,2016-10-16 14:33:25
3080829096.0,0.0,False,0.0,Poll: Clinton's Lead Growing in Virginia https://t.co/Novj6dApHb,[],[],1476659100000.0,2016-10-16 23:05:00
3080829096.0,1.0,False,0.0,Henrico 12-year-old featured in new Clinton video https://t.co/Tfjt58Tks9,[],[],1476923163000.0,2016-10-20 00:26:03
3080829096.0,0.0,False,0.0,The Latest:  Pence says Trump will accept 'clear result' https://t.co/yc22ZHN65R,[],[],1476999244000.0,2016-10-20 21:34:04
3080829096.0,0.0,False,0.0,The Latest:  Obama says no one keeps democracy in 'suspense' https://t.co/Kv49WfzjYJ,[],[],1477003828000.0,2016-10-20 22:50:28
3080829096.0,0.0,False,0.0,The Latest: Trump walks out on interview in OH https://t.co/PGo5wqQsRY,[],[],1477007985000.0,2016-10-20 23:59:45
3080829096.0,0.0,False,0.0,"The Latest: Trump, Clinton 1 seat apart at Al Smith dinner https://t.co/xFjf42pjcc",[],[],1477011866000.0,2016-10-21 01:04:26
3080829096.0,0.0,False,0.0,The Latest: Clinton super PAC has best fundraising month https://t.co/d4H8I9TQE3,[],[],1477016109000.0,2016-10-21 02:15:09
3080829096.0,0.0,False,0.0,Trump mocks critics: I'll accept election results   if I win https://t.co/UPZ7SmRFbQ,[],[],1477020529000.0,2016-10-21 03:28:49
3080829096.0,1.0,False,0.0,Off his message again: Trump vows to sue all female accusers https://t.co/zrc8JwLawI,[],[],1477177518000.0,2016-10-22 23:05:18
3080829096.0,0.0,False,0.0,Tim Kaine on 'Meet The Press' https://t.co/KrNhWfxbUY,[],[],1477236211000.0,2016-10-23 15:23:31
3080829096.0,0.0,False,0.0,Clinton up by 7 points in VA as Trump gains ground in new poll https://t.co/BwgYpk8wPN,[],[],1477650352000.0,2016-10-28 10:25:52
3080829096.0,1.0,False,0.0,UVA Students Protest Pipeline at Clinton Campaign Office https://t.co/SDnaUhv4l5,[],[],1477700108000.0,2016-10-29 00:15:08
3080829096.0,0.0,False,0.0,A look at FBI Comey's decisions in the Clinton email case https://t.co/ldnDrokxHc,[],[],1477781715000.0,2016-10-29 22:55:15
3080829096.0,0.0,False,0.0,A look at FBI chief Comey's decisions in Clinton email case https://t.co/aqyWUI1nTW,[],[],1477793697000.0,2016-10-30 02:14:57
