user_id,retweet_count,retweeted,favorite_count,text,hashtags,mentions,created_at,created_str
4355797094.0,107.0,False,86.0,"Clinton Foundation has ties with ISIS, that alone should be enough to end them once and for all #IranRansomScandal https://t.co/z1IWzHLP0p","[""IranRansomScandal""]",[],1470263433000.0,2016-08-03 22:30:33
4355797094.0,16.0,False,13.0,Clint Eastwood is one of the last great men. We live among kiss-ass generation. We need to change it now https://t.co/HjcywNBpxq,[],[],1470265386000.0,2016-08-03 23:03:06
4355797094.0,191.0,False,163.0,Hillary Clinton will be an end for America. Never let democrats to disarm you! #2A #NeverHillary https://t.co/l0wCwXy2Jl,"[""NeverHillary"",""2A""]",[],1470273469000.0,2016-08-04 01:17:49
4355797094.0,55.0,False,47.0,"2 Belgian police officers are wounded after man with a machete attacked them shouting allahu akbar.
Accepting refugees is accepting invaders",[],[],1470506100000.0,2016-08-06 17:55:00
4355797094.0,266.0,False,199.0,"Obama: rigged election is 'conspiracy theory and ridiculous'
Lying to whole nation even after #DNCleaks Disgrace! https://t.co/HoVgEVRgGa","[""DNCLeaks""]",[],1470508141000.0,2016-08-06 18:29:01
4355797094.0,128.0,False,105.0,"You know what country #BlackLivesMatter has no problem with? Qatar, which own slaves today and who supports Hillary Clinton campaign","[""Blacklivesmatter""]",[],1470516621000.0,2016-08-06 20:50:21
4355797094.0,924.0,False,839.0,"Giuliani on #IranRansom ""I call it money laundering""
Obama is a traitor of America. Criminals need to be punished https://t.co/qYnqK2DKdk","[""IranRansom""]",[],1470518847000.0,2016-08-06 21:27:27
4355797094.0,319.0,False,255.0,"State Department laughs at transparency and democracy.
I hope Im not the only one who is sick of corrupt politicians https://t.co/Aqi7KiSugP",[],[],1470522723000.0,2016-08-06 22:32:03
4355797094.0,750.0,False,418.0,"White House admitted #IranRansom might be funding terrorists.
Obama = money laundering, rigged election, terrorism https://t.co/pdmftyC9pZ","[""IranRansom""]",[],1470533432000.0,2016-08-07 01:30:32
4355797094.0,2089.0,False,1490.0,"#BlackLivesMatter thugs did this to a church. BLM is racist hate group.
No media coverage. Imagine if it was mosque https://t.co/TFu37W0u4M","[""Blacklivesmatter""]",[],1470594658000.0,2016-08-07 18:30:58
4355797094.0,208.0,False,181.0,Hillary Clinton so crooked she can't handle stairs. She couldn't win primaries with old commie so they were rigged https://t.co/jhYhD3iNr6,[],[],1470596516000.0,2016-08-07 19:01:56
4355797094.0,202.0,False,159.0,This pretty much sums up all response to church vandalism. He'll vote for Clinton. We must vote against. https://t.co/fTGHQ12zbs,[],[],1470605516000.0,2016-08-07 21:31:56
4355797094.0,2.0,False,4.0,@SpryUte Reagan wasn't best president for me. But current is worse,[],[],1470606077000.0,2016-08-07 21:41:17
4355797094.0,143.0,False,99.0,"German intelligence warns of IS ‘hit squads’ among refugees. Trump was right again. Don't accept refugees!
https://t.co/twVtGIMDV9",[],[],1470943856000.0,2016-08-11 19:30:56
4355797094.0,936.0,False,653.0,"Obama accidentally admitted ""We're training ISIS"". Traitor and disgrace of America https://t.co/FGkMCZjRAa",[],[],1470944450000.0,2016-08-11 19:40:50
4355797094.0,4.0,False,6.0,"So called BLM 'protesters' looting and destroying city they live. Domestic terrorists, nothing more. #Milwaukee https://t.co/G9BQfB0HHU","[""Milwaukee""]",[],1471200497000.0,2016-08-14 18:48:17
4355797094.0,157.0,False,142.0,"Rioters have targeted white people. BLM is movement of racists and thugs.
#Milwaukee https://t.co/TZT1hkfhdA","[""Milwaukee""]",[],1471201068000.0,2016-08-14 18:57:48
4355797094.0,172.0,False,107.0,"This is how polls are rigged, this is how election will be rigged if we won't do anything about it https://t.co/7pyn7dP3Ns",[],[],1471223118000.0,2016-08-15 01:05:18
4355797094.0,382.0,False,396.0,"Difference between Trump and Clinton? Trump sells out rallies, Clinton sells out America
#TrumpPence16 #MAGA https://t.co/MVBUm6jc2v","[""maga"",""TrumpPence16""]",[],1471226979000.0,2016-08-15 02:09:39
4355797094.0,65.0,False,37.0,Computer programmer testifies under oath he coded computers to rig elections. You voice is important! #RiggedSystem https://t.co/X8WjwV8EnD,"[""RiggedSystem""]",[],1471284823000.0,2016-08-15 18:13:43
4355797094.0,348.0,False,221.0,George Soros is one of the enemies of American nation. Stay united against him and his puppet Hillary Clinton! https://t.co/yZrJJqRYMq,[],[],1471296405000.0,2016-08-15 21:26:45
4355797094.0,47.0,False,29.0,Joe Biden puts national security at risk pointing to ss who has NUCLEAR CODES! We can't trust them power! https://t.co/5LUqmmeZGY,[],[],1471299142000.0,2016-08-15 22:12:22
4355797094.0,1964.0,False,1717.0,Joe Biden and Hillary Clinton rally at Scranton was half empty. Clinton and Biden both can't gather people https://t.co/V4A5b606ZL,[],[],1471306387000.0,2016-08-16 00:13:07
4355797094.0,172.0,False,145.0,#BlackLivesMatter are domestic terrorists that will solve nothing. Liberals supporting them are against unity https://t.co/vva1TpXuq7,"[""Blacklivesmatter""]",[],1471320017000.0,2016-08-16 04:00:17
4355797094.0,639.0,False,359.0,France is destroying 1868 Catholic church while allowing 2800 mosques to be build. Islamization must be stopped! https://t.co/prtMbpNcVn,[],[],1471546070000.0,2016-08-18 18:47:50
4355797094.0,59.0,False,48.0,Hillary Clinton is the opposite of prosperity. In fact Hillary Clinton herself is mentally and physically unstable. https://t.co/HX2yUyOBhE,[],[],1471550483000.0,2016-08-18 20:01:23
4355797094.0,89.0,False,59.0,"Hillary Clinton supports oppression of women, corrupt Government, taxes for middle class and sending men into war https://t.co/h44CWEAsuf",[],[],1471551010000.0,2016-08-18 20:10:10
4355797094.0,213.0,False,190.0,"Hillary Clinton's hometown Little Rock, AR knows her very well that's why they didn't fall into her lies https://t.co/SxyelthaNK",[],[],1471554205000.0,2016-08-18 21:03:25
4355797094.0,52.0,False,30.0,Iran ransom confirmed! US wouldn’t let Iran take $400 million til prisoners released https://t.co/FnQCzihyVk https://t.co/9mmfXiUJbd,[],[],1471555257000.0,2016-08-18 21:20:57
4355797094.0,682.0,False,519.0,State Dept admits $400m to Iran was ransom. And this is Obama lying to the faces of all Americans. The worst POTUS https://t.co/tr7UhInYiT,[],[],1471561103000.0,2016-08-18 22:58:23
4355797094.0,344.0,False,312.0,#BlackLivesMatter and New Black Panthers ignoring #LouisianaFlood just like their master Obama. https://t.co/wHgBhBAJCh,"[""LouisianaFlood"",""Blacklivesmatter""]",[],1471618825000.0,2016-08-19 15:00:25
4355797094.0,259.0,False,180.0,Hillary Clinton jokes about FBI investigation and liberal crowd applaud her. How people can support lying criminal? https://t.co/6jbkn2oCku,[],[],1471633121000.0,2016-08-19 18:58:41
4355797094.0,321.0,False,268.0,Donald Trump hands out supplies to #LouisianaFlood victims while Obama on vacation and Clinton can't walk on her own https://t.co/XHrmrWX6aC,"[""LouisianaFlood""]",[],1471639280000.0,2016-08-19 20:41:20
4355797094.0,14.0,False,13.0,"#WheresHillary Hillary can't handle stairs or stand without support, she never helped other Americans. https://t.co/GWf9aLOiDk","[""wheresHillary""]",[],1471643351000.0,2016-08-19 21:49:11
4355797094.0,73.0,False,84.0,Hillary Clinton can't come close to water because she will start malfunctioning #whereishillary #LouisianaFlood https://t.co/jvVwFibTZD,"[""LouisianaFlood"",""whereishillary""]",[],1471646146000.0,2016-08-19 22:35:46
4355797094.0,121.0,False,114.0,Hillary Clinton wears a catheter. Physically and mentally unfit into office. On top of that she is a criminal https://t.co/lTVs93Ei3W,[],[],1471646412000.0,2016-08-19 22:40:12
4355797094.0,266.0,False,223.0,Hillary Clinton spends $117m more than Trump on ads and $0 to help people in Louisiana. Corrupt! #whereishillary https://t.co/QruOuHTxlg,"[""whereishillary""]",[],1471648326000.0,2016-08-19 23:12:06
4355797094.0,90.0,False,115.0,Why people follow Trump? Because he is a leader that don't stand in the backs and makes Americans number 1 priority https://t.co/qQcycw5LdM,[],[],1471650260000.0,2016-08-19 23:44:20
4355797094.0,658.0,False,642.0,Trump donates 18-wheeler worth of supplies to #LouisianaFlood victims. #WheresHillary #WheresObama https://t.co/MPo8mMmeiu,"[""LouisianaFlood"",""WheresObama"",""wheresHillary""]",[],1471652296000.0,2016-08-20 00:18:16
4355797094.0,282.0,False,268.0,#LouisianaFlood victim calls out #BlackLivesMatter and Black Panthers for not helping people #WheresHillary https://t.co/CzRFyGOrG7,"[""Blacklivesmatter"",""LouisianaFlood"",""wheresHillary""]",[],1471654465000.0,2016-08-20 00:54:25
4355797094.0,178.0,False,142.0,"Obama refuses to survey the #LouisianaFlood but sends a memo telling La. people to not be racist. The worst POTUS!
https://t.co/YsfhmFcyyG","[""LouisianaFlood""]",[],1471665650000.0,2016-08-20 04:00:50
4355797094.0,154.0,False,147.0,Obama showed up in Louisiana.  Worthless president who is in cahoots with criminal Hillary Clinton https://t.co/e2FJ2vytiG,[],[],1471701637000.0,2016-08-20 14:00:37
4355797094.0,259.0,False,191.0,Trump puts America and its citizens first. Hillary Clinton put herself first. She will ruin our country https://t.co/LLW8s3rhYP,[],[],1471791624000.0,2016-08-21 15:00:24
4355797094.0,421.0,False,258.0,Clinton worker caught committing voter fraud in Las Vegas. Hillary Clinton can't win without rigged system https://t.co/qImrpZs2HM,[],[],1471890751000.0,2016-08-22 18:32:31
4355797094.0,50.0,False,47.0,"FBI found nearly 15,000 new Clinton emails. That's proving that Hillary Clinton lied about emails! #HillaryEmails
https://t.co/pfk8ZS0ijW","[""HillaryEmails""]",[],1471894795000.0,2016-08-22 19:39:55
4355797094.0,92.0,False,68.0,"Hillary Clinton is a typical politician that only wants power. We had enough of corruption, no more! #HillarysEmails https://t.co/xWZsG7Uqrs","[""HillarysEmails""]",[],1471895795000.0,2016-08-22 19:56:35
4355797094.0,78.0,False,110.0,This is a truck I can get behind #HillarysEmails #HillarysHuma #Benghazi https://t.co/Fo8KeJdQgP,"[""Benghazi"",""HillarysEmails"",""HillarysHuma""]",[],1471899387000.0,2016-08-22 20:56:27
4355797094.0,162.0,False,117.0,The Clinton Foundation accepted millions from foreign Governments. Clinton never was pro-American #HillarysEmails https://t.co/ULXhtUsjcn,"[""HillarysEmails""]",[],1471902581000.0,2016-08-22 21:49:41
4355797094.0,216.0,False,124.0,Eric Shawn reports investigation results of a voter fraud. Rigged system is real. #HillarysEmails https://t.co/q2dWvYBTi6,"[""HillarysEmails""]",[],1471905082000.0,2016-08-22 22:31:22
4355797094.0,69.0,False,41.0,"Hillary Clinton has employed a woman who worked for 12 YEARS at a Radical Islamic publication #HillarysEmails
https://t.co/A8sa6ayCbI","[""HillarysEmails""]",[],1471907625000.0,2016-08-22 23:13:45
4355797094.0,146.0,False,83.0,Emails show Clinton Foundation sought access to State Dept on donors’ behalf #HillarysEmails https://t.co/75io0J3wja https://t.co/Sa7pyjIj3W,"[""HillarysEmails""]",[],1471916626000.0,2016-08-23 01:43:46
4355797094.0,70.0,False,53.0,US Army training slide considers Hillary Clinton an insider threat. #IndictHillary #Hillary4Prison https://t.co/FpO4XFJObp,"[""IndictHillary"",""Hillary4prison""]",[],1471976876000.0,2016-08-23 18:27:56
4355797094.0,60.0,False,42.0,Hospital this way Hillary Clinton signs at Los Angeles hospitals #HillarysHealth #HillarysEmails #IndictHillary https://t.co/Qr7ZYI7SFk,"[""HillarysEmails"",""IndictHillary"",""HillarysHealth""]",[],1471978558000.0,2016-08-23 18:55:58
4355797094.0,149.0,False,129.0,What I saw is Hillary Clinton had already opened pickle jar. More pathetic that she needed to lie about it too https://t.co/c0Bk0pZd5P,[],[],1471982227000.0,2016-08-23 19:57:07
4355797094.0,87.0,False,72.0,Hillary Clinton physically unfit into office. More than that she's morally unfit. Hillary is a criminal #SickHillary https://t.co/jIw0vESk6r,"[""SickHillary""]",[],1471986547000.0,2016-08-23 21:09:07
4355797094.0,505.0,False,438.0,"Guns don't kill people, Hillary Clinton kills people #ClintonBodyCount #SickHillary #IndictHillary https://t.co/mkt3R2yKwW","[""ClintonBodyCount"",""SickHillary"",""IndictHillary""]",[],1471987752000.0,2016-08-23 21:29:12
4355797094.0,179.0,False,163.0,Hillary Clinton lied to Patricia Smith about why her son was killed in Benghazi. She deserves truth! #SickHillary https://t.co/cQ8vMLE2zJ,"[""SickHillary""]",[],1471991557000.0,2016-08-23 22:32:37
4355797094.0,242.0,False,311.0,Couple dressed like Hillary and Bill Clinton in jail uniforms at Austin Trump Rally #Hillary4Prison #SickHillary https://t.co/xOvKmRFejU,"[""Hillary4prison"",""SickHillary""]",[],1471995726000.0,2016-08-23 23:42:06
4355797094.0,130.0,False,96.0,Radical Islam is the definition of anti-women. If you care about American women - stop Hillary Clinton #SickHillary https://t.co/8AnDOqmcbg,"[""SickHillary""]",[],1471998784000.0,2016-08-24 00:33:04
4355797094.0,183.0,False,243.0,"Right now at Trump Rally in Austin, TX. Black or white we don't care. Trump will unite America! #TrumpinATX https://t.co/DSTz1SpaIO","[""TrumpinATX""]",[],1471999127000.0,2016-08-24 00:38:47
4355797094.0,31.0,False,34.0,Hillary and Bill Clinton in jail uniforms. Closer look. Very good!  #TrumpinATX  https://t.co/08GRfNoYNy,"[""TrumpinATX""]",[],1471999253000.0,2016-08-24 00:40:53
4355797094.0,89.0,False,133.0,Liberals are desperate. Austin Trump rally is happening RIGHT NOW. They also can't spell word cancelled correctly #WhyTrumpCanceledRallies,"[""WhyTrumpCanceledRallies""]",[],1472002088000.0,2016-08-24 01:28:08
4355797094.0,2033.0,False,2958.0,Unsecured network at Trump Austin rally called Clinton Email Server. Pure gold #TrumpinATX #SickHillary https://t.co/5Tt5UFZkxO,"[""SickHillary"",""TrumpinATX""]",[],1472002784000.0,2016-08-24 01:39:44
4355797094.0,194.0,False,202.0,The American's Creed. No way we let globalist take away our values https://t.co/Xv6l3xz496,[],[],1472242527000.0,2016-08-26 20:15:27
4355797094.0,114.0,False,94.0,Hillary Clinton takes money from Saudi and Bill Clinton is a rapist. She won't help women! #WomensEqualityDay https://t.co/NrYfPPR1Mg,"[""WomensEqualityDay""]",[],1472249828000.0,2016-08-26 22:17:08
4355797094.0,146.0,False,156.0,Church with a message to liberals.  Political correctness is ruining our society! https://t.co/jpwalaNUli,[],[],1472252480000.0,2016-08-26 23:01:20
4355797094.0,40.0,False,28.0,"Dr. Alveda King, niece of MLK, says Trump is a better choice for urban communities across America #TrumpPence16 https://t.co/8MqL2YWq5Z","[""TrumpPence16""]",[],1472258928000.0,2016-08-27 00:48:48
4355797094.0,194.0,False,182.0,With rigged election dead are voting for Hillary Clinton. That's we can stop! Save America #TrumpPence16 https://t.co/bUI5eaw1Uq,"[""TrumpPence16""]",[],1472265785000.0,2016-08-27 02:43:05
4355797094.0,186.0,False,157.0,"Don't believe a single word from Hillary Clinton's mouth. Her lies cost American lives
#HillaryClintonSearchTerms https://t.co/wGOxzHKAN2","[""HillaryClintonSearchTerms""]",[],1472326318000.0,2016-08-27 19:31:58
4355797094.0,195.0,False,169.0,We should take care about Americans first. Borders must be secured. If we can't help ourselves we can't help others https://t.co/xHijQbfmpK,[],[],1472328906000.0,2016-08-27 20:15:06
4355797094.0,93.0,False,31.0,"Muslim woman gets flogged for WEARING TROUSERS. The harsh reality of Sharia Law that liberals accept, but we won't https://t.co/1VNW6wRGU9",[],[],1472330802000.0,2016-08-27 20:46:42
4355797094.0,109.0,False,108.0,Truth from Andrew Breitbart. Remebmer he was probably assassinated by Clintons too #HillaryClintonSearchTerms https://t.co/0yJPZJfmsh,"[""HillaryClintonSearchTerms""]",[],1472337900000.0,2016-08-27 22:45:00
4355797094.0,173.0,False,114.0,"Our main priority is to stop Hillary Clinton, if we lose we'll lose our future #IndictHillary #TrumpPence16 https://t.co/P521ljRy7U","[""TrumpPence16"",""IndictHillary""]",[],1472339351000.0,2016-08-27 23:09:11
4355797094.0,0.0,False,0.0,"Americans chant 'Hillary is racist' outside Clinton fundraiser in Miami.
Hillary Clinton won't escape judgement! https://t.co/VNkZzGBeqV",[],[],1472345882000.0,2016-08-28 00:58:02
4355797094.0,78.0,False,112.0,"Another sign paid by working Americans, now in Scranton, PA! #TrumpPence16 #MakeAmericaGreatAgain https://t.co/oLvrA53ck4","[""MakeAmericaGreatAgain"",""TrumpPence16""]",[],1472346369000.0,2016-08-28 01:06:09
4355797094.0,1033.0,False,736.0,"Larry King tells Bill Clinton: ""CNN will serve you after you're elected"" caught on camera whispering to each other https://t.co/TUNmrmNty7",[],[],1472348613000.0,2016-08-28 01:43:33
4355797094.0,69.0,False,66.0,Hillary Clinton will continue mess that Obama created. Mess that we don't need! #IndictHillary #Hillary4Prison https://t.co/wOl9nx0IJ6,"[""Hillary4prison"",""IndictHillary""]",[],1472579406000.0,2016-08-30 17:50:06
4355797094.0,119.0,False,65.0,Footage taken secretly in a UK Muslim school. Liberals accept this. Islam has no place in modern world https://t.co/aYospfeJHC,[],[],1472582497000.0,2016-08-30 18:41:37
4355797094.0,121.0,False,85.0,Reminder that Hillary Clinton didn't have a single press conference this year! She can only lie #IndictHillary https://t.co/kq55wDXhEp,"[""IndictHillary""]",[],1472588295000.0,2016-08-30 20:18:15
4355797094.0,3.0,False,2.0,"With that ""attire"" Hillary Clinton looks like leaving a hospital, which can be true. #HillarysHealth https://t.co/tZQ9GVSTcW","[""HillarysHealth""]",[],1472592567000.0,2016-08-30 21:29:27
4355797094.0,261.0,False,191.0,"New Benghazi emails lead directly to Obama. Hillary Clinton and Barack Obama are criminals. Save America from them!
https://t.co/BTNerNTF07",[],[],1472594702000.0,2016-08-30 22:05:02
4355797094.0,79.0,False,62.0,"Sick Hillary Clinton struggles to get out of a van, nearly falls again. #HillarysHealth https://t.co/VmblkuQtnq","[""HillarysHealth""]",[],1472599086000.0,2016-08-30 23:18:06
4355797094.0,0.0,False,0.0,Hillary Clinton lied about fucking pickle jar! It's small thing but it shows us who Clinton really is #IndictHillary https://t.co/d027gN2GHi,"[""IndictHillary""]",[],1472601981000.0,2016-08-31 00:06:21
4355797094.0,35.0,False,44.0,Simple logic by Clint Eastwood https://t.co/lGmRPy76sb,[],[],1472604211000.0,2016-08-31 00:43:31
4355797094.0,0.0,False,0.0,Great people at Trump rally in Everett! Definitely will #MakeAmericaGreatAgain #Benghazi #Hillary4Prison #TrumpWA https://t.co/TWvUJEpw5k,"[""Benghazi"",""MakeAmericaGreatAgain"",""TrumpWA"",""Hillary4prison""]",[],1472604844000.0,2016-08-31 00:54:04
4355797094.0,8.0,False,2.0,"Obama wants to control elections We cant have voter ID laws but party in power will use fed agency to ensure victory
https://t.co/N1GNMirZ14",[],[],1472605660000.0,2016-08-31 01:07:40
4355797094.0,132.0,False,116.0,There are two Americas. And we don't want the one with corrupt lying criminal Hillary Clinton #TrumpWA https://t.co/F65JEr8WQW,"[""TrumpWA""]",[],1472607305000.0,2016-08-31 01:35:05
4355797094.0,3873.0,False,2144.0,George Soros literally says Trump will win popular vote but it's already been decided that Clinton will be the POTUS https://t.co/fz2Tjt70nt,[],[],1472668884000.0,2016-08-31 18:41:24
4355797094.0,55.0,False,52.0,Difference between honest man and corrupt politician is number of press conferences this year #IndictHillary https://t.co/W4LclPlAKe,"[""IndictHillary""]",[],1472674370000.0,2016-08-31 20:12:50
4355797094.0,83.0,False,81.0,Trump met with a Mexican leader while Clinton who is responsible for NAFTA is sleeping! TPP is new NAFTA but worse! https://t.co/tJ2rPnydQU,[],[],1472676874000.0,2016-08-31 20:54:34
4355797094.0,0.0,False,0.0,Hillary Clinton on NAFTA. We let this happen but we won't let this to continue! No NAFTA! No TPP! #TrumpPence16 https://t.co/giJAKIbsOZ,"[""TrumpPence16""]",[],1472677089000.0,2016-08-31 20:58:09
4355797094.0,262.0,False,321.0,Trump makes deals with leaders. Together fighting criminals to secure prosperity. Very presidential #TrumpEnMexico https://t.co/pOkHKliLGM,"[""TrumpEnMexico""]",[],1472680767000.0,2016-08-31 21:59:27
4355797094.0,467.0,False,431.0,This guy at Phoenix rally. Illegals that liberals are protecting ARE criminals and Obama pardons them #TrumpEnMexico https://t.co/OEnzHXTRcQ,"[""TrumpEnMexico""]",[],1472684438000.0,2016-08-31 23:00:38
4355797094.0,287.0,False,281.0,Both candidates were invited by Mexican president. Hillary Clinton is unable for diplomacy we need #TrumpEnMexico https://t.co/5YgW7nITqi,"[""TrumpEnMexico""]",[],1472690338000.0,2016-09-01 00:38:58
4355797094.0,5.0,False,5.0,"August most violent month in Chicago in nearly 20 years. Liberals say we don't have problems in cities. Ignorance!
https://t.co/aCzYmRTcR2",[],[],1472692606000.0,2016-09-01 01:16:46
4355797094.0,459.0,False,559.0,"Phoenix Trump rally. Crowd is huge, Hillary Clinton could never gather that much people #Phoenix  #TrumpEnMexico https://t.co/YdNhWdPhpK","[""Phoenix"",""TrumpEnMexico""]",[],1472695342000.0,2016-09-01 02:02:22
4355797094.0,17.0,False,29.0,Giuliani with Make Mexico Great Again Also hat at Phoenix Trump rally! #TrumpEnMexico https://t.co/rIFwBO2ViH,"[""TrumpEnMexico""]",[],1472695638000.0,2016-09-01 02:07:18
4355797094.0,226.0,False,129.0,"Hillary Clinton AGAIN calls Patricia Smith, Benghazi victim’s mom, a liar. #Hillary4Prison #TrumpInDetroit https://t.co/eVFick1hZS","[""TrumpinDetroit"",""Hillary4prison""]",[],1472926644000.0,2016-09-03 18:17:24
4355797094.0,165.0,False,130.0,CNN reporter stunned when fact checkers confirm Hillary's phones were destroyed with hammers. #Hillary4Prison https://t.co/kI9pFyq847,"[""Hillary4prison""]",[],1472930779000.0,2016-09-03 19:26:19
4355797094.0,264.0,False,211.0,If you support Hillary Clinton you support Huma Abedin who has ties with radical islamists #Hillary4prison https://t.co/WGqgeQhNm4,"[""Hillary4prison""]",[],1472939575000.0,2016-09-03 21:52:55
4355797094.0,321.0,False,240.0,Reuters cuts feed just as Donald Trump is being blessed by Bishop Jackson. #TrumpInDetroit #RiggedSystem https://t.co/olq3KF1GUt,"[""RiggedSystem"",""TrumpinDetroit""]",[],1472942472000.0,2016-09-03 22:41:12
4355797094.0,41.0,False,47.0,Democrats won't take our rights! #2A #TrumpPence16 #MakeAmericaGreatAgain https://t.co/7mFI3Hs7Js,"[""2A"",""MakeAmericaGreatAgain"",""TrumpPence16""]",[],1473017140000.0,2016-09-04 19:25:40
4355797094.0,79.0,False,70.0,All four moderators in Presidential debates are Democrats. Rigged system. But they won't stop us https://t.co/6i0PshO2Pg,[],[],1473021128000.0,2016-09-04 20:32:08
4355797094.0,133.0,False,122.0,Obama is worst leader. Good leader would turn around and left for such disrespect. But Obama doesn't respect America https://t.co/8mZqSYyisW,[],[],1473021670000.0,2016-09-04 20:41:10
4355797094.0,75.0,False,87.0,Liberals still have 'Trump is racist' as their main argument.  You don't need to think if u support Hillary Clinton https://t.co/l8NS0DOLEp,[],[],1473025372000.0,2016-09-04 21:42:52
4355797094.0,335.0,False,225.0,"If we allow Hillary Clinton to win this will be our schools. Merkel destroyed Germany, Clinton will destroy America https://t.co/p7OHczsGrr",[],[],1473027122000.0,2016-09-04 22:12:02
4355797094.0,37.0,False,43.0,Quote from Ronald Reagan to all liberals. #NeverHillary https://t.co/3xqWWPTKXS,"[""NeverHillary""]",[],1473029616000.0,2016-09-04 22:53:36
4355797094.0,79.0,False,59.0,"National Front leader Marine Le Pen: Clinton means war, Clinton means devastation...world instability #IndictHillary
https://t.co/BpxlQsAVNv","[""IndictHillary""]",[],1473032864000.0,2016-09-04 23:47:44
4355797094.0,0.0,False,0.0,"Hillary Clinton charges CHILDREN $2,700 for a chance to ask her a question. Corrupt beyond redemtion
https://t.co/PQIii4q5bR",[],[],1473032984000.0,2016-09-04 23:49:44
4355797094.0,412.0,False,339.0,"Muslim wife says ""Fuck America"". Husband arrested for food stamp fraud and burglary! Cultural enrichment my ass https://t.co/g49zVrakop",[],[],1473037112000.0,2016-09-05 00:58:32
4355797094.0,106.0,False,76.0,"Apparently Hillary Clinton uses wheelchair van. Hillary Clinton so sick, mentally and physically. #HillarysHealth https://t.co/nr1WuQgS7v","[""HillarysHealth""]",[],1473041971000.0,2016-09-05 02:19:31
4355797094.0,187.0,False,121.0,"If you don't want your freedom be taken by Obama you must act now! Don't be silent, do your part! #TrumpPence16 https://t.co/ej2b1PLPNI","[""TrumpPence16""]",[],1473043582000.0,2016-09-05 02:46:22
4355797094.0,43.0,False,44.0,"Trump’s Florida Team Delivering Supplies to Those Affected by Cyclone Hermine #TrumpPence16
https://t.co/NO8tAhCgkd","[""TrumpPence16""]",[],1473048442000.0,2016-09-05 04:07:22
4355797094.0,164.0,False,154.0,That is what we are talking about when we say #MakeAmericaGreatAgain Obama is no leader https://t.co/vsLOhxPn9o,"[""MakeAmericaGreatAgain""]",[],1473092533000.0,2016-09-05 16:22:13
4355797094.0,122.0,False,119.0,Working class must act against Hillary Clinton! We work for America not for rich and corrupt! #IndictHillary https://t.co/53MsTLdHPr,"[""IndictHillary""]",[],1473094819000.0,2016-09-05 17:00:19
4355797094.0,122.0,False,154.0,"Liberals who say we hate Mexicans think all Mexicans are illegal. That's racist. Legal - ok, illegal - not ok https://t.co/deXMdpubW4",[],[],1473177545000.0,2016-09-06 15:59:05
4355797094.0,144.0,False,115.0,"Future of America depends on this election, no matter what we can't let Hillary Clinton win #TrumpPence16 https://t.co/crzWQgpogr","[""TrumpPence16""]",[],1473181219000.0,2016-09-06 17:00:19
4355797094.0,200.0,False,89.0,Middle eastern refugees are bringing Shariah law to the West. This is UK right now and most of EU. #StopIslam https://t.co/O6sMxN1ANq,"[""STOPIslam""]",[],1473271105000.0,2016-09-07 17:58:25
