user_id,retweet_count,retweeted,favorite_count,text,hashtags,mentions,created_at,created_str
4355797094.0,4007.0,False,5401.0,"That's the retard who tried to kill Donald Trump in Ohio. Armed with a knife, he tried to stab a security officer https://t.co/MXaOebedXt",[],[],1457821916000.0,2016-03-12 22:31:56
4355797094.0,423.0,False,456.0,"Law enforcement supports Donald Trump.
Thank you guys!
#Trump2016 https://t.co/aaqrJdYdEh","[""Trump2016""]",[],1459717423000.0,2016-04-03 21:03:43
4355797094.0,98.0,False,40.0,"WTF is that?? Is this America or Iraq?
Muslim US Army captain allowed to wear turban
https://t.co/gTNeSBy80G https://t.co/HvO9A21DVF",[],[],1459888050000.0,2016-04-05 20:27:30
4355797094.0,212.0,False,215.0,"True that.
GOP will be changed or it will be destroyed.
#Trump2016 https://t.co/iqgOwWzP2D","[""Trump2016""]",[],1460577309000.0,2016-04-13 19:55:09
4355797094.0,254.0,False,194.0,"Don't forget! California you must be registered Republican by May 23, 2016 to vote for TRUMP. 
Do it now! https://t.co/9DE2GOozuw",[],[],1461284846000.0,2016-04-22 00:27:26
4355797094.0,408.0,False,441.0,Trump never said anything racist or xenophobic. That's what the liberal media wants you to believe. https://t.co/f3SynO7fkD,[],[],1463256049000.0,2016-05-14 20:00:49
4355797094.0,196.0,False,289.0,"The Law Enforcement community loves Donald Trump!
Let's make America great again together https://t.co/wC14m084Zc",[],[],1463533859000.0,2016-05-18 01:10:59
4355797094.0,430.0,False,217.0,"Damn. They are still going to build the Islamic museum at the Ground zero. 
Obama the Muslim backstabbed America. https://t.co/bmMlXST9qL",[],[],1463945178000.0,2016-05-22 19:26:18
4355797094.0,76.0,False,80.0,I just can't wait when we kick that muslims traitorous ass out of White House #MakeAmericaGreatAgain https://t.co/ondAwFZ0MV,"[""MakeAmericaGreatAgain""]",[],1465069807000.0,2016-06-04 19:50:07
4355797094.0,97.0,False,68.0,"ow pathetic we became under Obama's rule. Time to take America back, eliminate enemies and #MakeAmericaGreatAgain https://t.co/xAbfoAaK85","[""MakeAmericaGreatAgain""]",[],1466106344000.0,2016-06-16 19:45:44
4355797094.0,75.0,False,49.0,We had enough of Hillary Clinton! We won't let her ruin America. #IndictHillary https://t.co/dwoV9Puftz,"[""IndictHillary""]",[],1466107386000.0,2016-06-16 20:03:06
4355797094.0,166.0,False,113.0,John McCain said Obama is responsible for Orlando. Obama's agenda is with muslims not with Americans! https://t.co/AvrH2nCmru,[],[],1466117040000.0,2016-06-16 22:44:00
4355797094.0,231.0,False,162.0,"Obama is a failure, but he dares to blame guns and call everyone who disagrees with him racist. Enough! #Trump2016 https://t.co/Gwnz6qZl6s","[""Trump2016""]",[],1466117539000.0,2016-06-16 22:52:19
4355797094.0,444.0,False,373.0,After we remove traitor Obama from office we will never give away billions to illegals. Veterans deserve it more! https://t.co/Ys6ja25pKc,[],[],1466470903000.0,2016-06-21 01:01:43
4355797094.0,190.0,False,143.0,No one who thinks that Islam is peaceful should be a president! And we know Hillary Clinton has muslim agenda https://t.co/Sz1ixll5Yh,[],[],1466817941000.0,2016-06-25 01:25:41
4355797094.0,348.0,False,289.0,Never forget #Benghazi Never forgive Hillary Clinton for murdering Americans https://t.co/amTKWhCKVd,"[""Benghazi""]",[],1467142671000.0,2016-06-28 19:37:51
4355797094.0,109.0,False,72.0,"Hillary Clinton first action if she becomes president.
We won't let it happen! #VoteTrump2016 #MakeAmericaGreatAgain https://t.co/ocX7pAGjBu","[""MakeAmericaGreatAgain"",""VoteTrump2016""]",[],1467151515000.0,2016-06-28 22:05:15
4355797094.0,233.0,False,194.0,Hillary Clinton only accomplishment is evading prison. But it won't last long! #IndictHillary #Hillary4prison https://t.co/ZBRidCKAAb,"[""Hillary4prison"",""IndictHillary""]",[],1467157469000.0,2016-06-28 23:44:29
4355797094.0,171.0,False,131.0,"Obama will never let us to #IndictHillary He wants his legacy to be continued.
We can't allow it #VoteTrump2016 https://t.co/A23rKrgV7I","[""VoteTrump2016"",""IndictHillary""]",[],1467165244000.0,2016-06-29 01:54:04
4355797094.0,230.0,False,241.0,Obama's transformation of America is disgusting. Worst president and embarrassment for all Americans https://t.co/TokwBjIeHQ,[],[],1467313282000.0,2016-06-30 19:01:22
4355797094.0,139.0,False,132.0,Europe is lost. If we don't want same here we should not accept any refugees and vote against Hillary Clinton! https://t.co/dW1UDsNqdw,[],[],1467401223000.0,2016-07-01 19:27:03
4355797094.0,175.0,False,135.0,"All you need to know about Hillary Clinton in this photo with soldier with sign of coercion. 
Clinton = end of USA https://t.co/YCVx9d0o2l",[],[],1467410165000.0,2016-07-01 21:56:05
4355797094.0,96.0,False,102.0,Words of a true leader! Donald Trump will #MakeAmericaGreatAgain #VoteTrump2016 https://t.co/E3sox1OegU,"[""VoteTrump2016"",""MakeAmericaGreatAgain""]",[],1467423455000.0,2016-07-02 01:37:35
4355797094.0,160.0,False,111.0,"There is no such thing as 'white privilege'.
#WakeUpAmerica https://t.co/xtj2VgMtcR","[""WakeUpAmerica""]",[],1467497863000.0,2016-07-02 22:17:43
4355797094.0,191.0,False,114.0,Hillary Clinton thinks Islam has nothing to do with terrorists. Clinton's foreign policy will be another disaster https://t.co/yv1P3kbCa8,[],[],1467498902000.0,2016-07-02 22:35:02
4355797094.0,54.0,False,50.0,"Small town in America knows what is right. Hillary Clinton isn't too big for jail, she will fit there perfectly! https://t.co/jNhm1BE8N2",[],[],1467503405000.0,2016-07-02 23:50:05
4355797094.0,116.0,False,86.0,"All terrorists will be punished! Obama and Clinton won't escape our American justice
#MakeAmericaGreatAgain #2A https://t.co/Of4lPMB9ab","[""2A"",""MakeAmericaGreatAgain""]",[],1467505874000.0,2016-07-03 00:31:14
4355797094.0,111.0,False,127.0,"This is also how i imagine every women voting for Hillary Clinton
#IndictHillary #Women4Trump https://t.co/j21CD2tAJf","[""IndictHillary"",""Women4Trump""]",[],1467507003000.0,2016-07-03 00:50:03
4355797094.0,462.0,False,374.0,I'm still waiting for liberals to explain me how they can support a lying criminal Hillary Clinton for president https://t.co/BnqChR8KI4,[],[],1467508505000.0,2016-07-03 01:15:05
4355797094.0,223.0,False,144.0,Hillary Clinton flies with Obama on Plane One. System is more corrupted than we thought. All under Obama's reign https://t.co/YcTSwbrYW6,[],[],1467751732000.0,2016-07-05 20:48:52
4355797094.0,354.0,False,273.0,"The fact that Democrats are still going to vote for Hillary Clinton is also disturbing
#WakeUpAmerica https://t.co/7rvnGmzEwy","[""WakeUpAmerica""]",[],1467758855000.0,2016-07-05 22:47:35
4355797094.0,344.0,False,301.0,"Obama and Clinton are destroying our country, our values are nothing for them. We must stop it! https://t.co/cp8hMv8e19",[],[],1467833185000.0,2016-07-06 19:26:25
4355797094.0,56.0,False,61.0,Obama says he will keep 8k U.S. troops in Afghanistan. Afghanistan produces 90% of world's heroin. Obama is the biggest drug lord in history,[],[],1467834818000.0,2016-07-06 19:53:38
4355797094.0,58.0,False,55.0,Nixon lives in Hillary Clinton and now more powerful than ever. https://t.co/Wn5cJETAdj,[],[],1467843441000.0,2016-07-06 22:17:21
4355797094.0,43.0,False,49.0,"Hillary Clinton and mosquito has one thing in common - they both suck
#VoteTrump #MakeAmericaGreatAgain https://t.co/EGSR996gk7","[""MakeAmericaGreatAgain"",""VoteTrump""]",[],1467854642000.0,2016-07-07 01:24:02
4355797094.0,110.0,False,84.0,Obama is dividing our nation. Democrats don't care about people! Blue Lives Matter. All Lives Matter https://t.co/ymihKXPknk,[],[],1468090732000.0,2016-07-09 18:58:52
4355797094.0,231.0,False,206.0,Obama is a traitor. He fuels hatred and is trying to divide our nation. https://t.co/rMrrls13Y7,[],[],1468099282000.0,2016-07-09 21:21:22
4355797094.0,287.0,False,248.0,Blood of police officers in Dallas are on Obama's hand. And on every Democrat supporting him or Hillary Clinton https://t.co/BKk59DvRkH,[],[],1468104543000.0,2016-07-09 22:49:03
4355797094.0,97.0,False,69.0,"""Peaceful"" BLM protesters throwing fireworks at Police! Need more rubber bullets for #BlackLivesMatter thugs https://t.co/2swcZzVpkh","[""Blacklivesmatter""]",[],1468174663000.0,2016-07-10 18:17:43
4355797094.0,96.0,False,89.0,We need to make America safe. First thing we should do is eliminate criminals such as Obama and Clinton https://t.co/XAPWnE1ZrR,[],[],1468183555000.0,2016-07-10 20:45:55
4355797094.0,435.0,False,421.0,"Sheriff Clarke is right, Obama created aggression towards police within 7 years of his presidency. https://t.co/EE2big01Da",[],[],1468265707000.0,2016-07-11 19:35:07
4355797094.0,186.0,False,158.0,"Obama did great job destroying our country. Be sure Hillary Clinton will continue his work
#VoteTrump2016 https://t.co/5KgOKupSe9","[""VoteTrump2016""]",[],1468290496000.0,2016-07-12 02:28:16
4355797094.0,426.0,False,342.0,"Bernie Sanders endorses criminal pro-TPP Hillary Clinton. Sellout!
P.S. No refunds to donations! #FeelTheBern https://t.co/muogS08Anf","[""feelthebern""]",[],1468346463000.0,2016-07-12 18:01:03
4355797094.0,347.0,False,228.0,"One fact about Lynch. Clinton corruption is everywhere. 
#LynchHearing https://t.co/3Y2lhO8Cfs","[""LynchHearing""]",[],1468347801000.0,2016-07-12 18:23:21
4355797094.0,412.0,False,378.0,Obama defends BLM at #DallasMemorial and blame guns! Truly disgraceful and traitorous president. Not my president https://t.co/xujz1DiCoF,"[""DallasMemorial""]",[],1468355899000.0,2016-07-12 20:38:19
4355797094.0,493.0,False,458.0,"Defending BLM is disgusting, but Obama promoting Islam during #DallasMemorial makes me really sick. https://t.co/FpDpLCmWED","[""DallasMemorial""]",[],1468360442000.0,2016-07-12 21:54:02
4355797094.0,347.0,False,314.0,"Difference between President Obama and President George W. Bush. Faces behind them say it all
#DallasMemorial https://t.co/tRJQp7ZY5D","[""DallasMemorial""]",[],1468362731000.0,2016-07-12 22:32:11
4355797094.0,178.0,False,168.0,That's a great analogy. Vote for Hillary Clinton is vote against our future https://t.co/LvnKclbhfE,[],[],1468368278000.0,2016-07-13 00:04:38
4355797094.0,57.0,False,68.0,You guys really wanted old marxist Bernie Sanders be a POTUS? Democrats are knows for their poor choice of leaders https://t.co/JB6RkaH0Uf,[],[],1468429222000.0,2016-07-13 17:00:22
4355797094.0,146.0,False,137.0,Hillary Clinton is not fit into the office. She is mentally ill and a criminal. Put her into asylum or prison! https://t.co/ID8TjM80K5,[],[],1468447924000.0,2016-07-13 22:12:04
4355797094.0,119.0,False,116.0,We can't let criminal to continue destruction of our country! #VoteTrump2016 #MakeAmericaGreatAgain https://t.co/F8NRc7Vt9F,"[""MakeAmericaGreatAgain"",""VoteTrump2016""]",[],1468533610000.0,2016-07-14 22:00:10
4355797094.0,16.0,False,10.0,Obama Simulator: Who is responsible for #Nice06 attack?,"[""Nice06""]",[],1468536908000.0,2016-07-14 22:55:08
4355797094.0,218.0,False,170.0,"Hillary Clinton will never be able to deal with terrorists! We need a true leader!
#PrayForNice https://t.co/ToJIXiT1S8","[""PrayForNice""]",[],1468561084000.0,2016-07-15 05:38:04
4355797094.0,94.0,False,43.0,#BlackLivesMatter activists celebrating death of police officers after #BatonRouge shooting. Disgusting https://t.co/Ot4XC5R1xJ,"[""BatonRouge"",""Blacklivesmatter""]",[],1468782051000.0,2016-07-17 19:00:51
4355797094.0,150.0,False,128.0,Make America Safe Again. Stop criminals who are dividing us like Obama and Clinton! #TrumpPence16 https://t.co/BTx0rKAKYG,"[""TrumpPence16""]",[],1468790627000.0,2016-07-17 21:23:47
4355797094.0,173.0,False,163.0,Blue Lives Matter. Support people who are risking their lives to protect you! https://t.co/ykycNO0TIa,[],[],1468871437000.0,2016-07-18 19:50:37
4355797094.0,226.0,False,182.0,Time to take America back from the hands of traitors like Obama! #RNCinCLE https://t.co/QT9Gt6MBpz,"[""RNCinCLE""]",[],1468875792000.0,2016-07-18 21:03:12
4355797094.0,81.0,False,52.0,"Islamic terrorist attacked with an axe in Germany. 
Axes, trucks, planes, bombs - gun control won't do shit https://t.co/c2aLLlOuxC",[],[],1468880352000.0,2016-07-18 22:19:12
4355797094.0,222.0,False,212.0,Obama will defend Islam despite every evidence and fact we have! Remove the traitor! #MakeAmericaSafeAgain https://t.co/47hEkbRCGH,"[""MakeAmericaSafeAgain""]",[],1468881134000.0,2016-07-18 22:32:14
4355797094.0,243.0,False,250.0,Never forgive Hillary Clinton for #Benghazi ! She will be put into cell https://t.co/7fUkcUOsFK,"[""Benghazi""]",[],1468890004000.0,2016-07-19 01:00:04
4355797094.0,1.0,False,0.0,"Sheriff Clarke, a democrat who is speaking at #RNCinCLE : ""Blue Lives Matter in America!"" https://t.co/MWuT1dw9c8","[""RNCinCLE""]",[],1468893394000.0,2016-07-19 01:56:34
4355797094.0,4.0,False,7.0,"A man who can think for himself, can't be labeled and put into certain group which Democrats desperately want https://t.co/QoMcAiaRJJ",[],[],1469127511000.0,2016-07-21 18:58:31
4355797094.0,184.0,False,178.0,"More pathetic than Hillary Clinton are the ones who support her
#Hillary4Prison #MakeAmericaGreatAgain https://t.co/A9acPKEflh","[""Hillary4prison"",""MakeAmericaGreatAgain""]",[],1469140653000.0,2016-07-21 22:37:33
4355797094.0,91.0,False,112.0,Trump will eliminate terrorists within and outside! #MakeAmericaSafeAgain #MakeAmericaOneAgain https://t.co/tPdqdgwsqn,"[""MakeAmericaSafeAgain"",""MakeAmericaOneAgain""]",[],1469156375000.0,2016-07-22 02:59:35
4355797094.0,285.0,False,190.0,Just a photo of Barack Obama teaching #BlackLivesMatter activist how to kill police officers https://t.co/z3bNVTd9As,"[""Blacklivesmatter""]",[],1469160018000.0,2016-07-22 04:00:18
4355797094.0,17.0,False,31.0,"3 dead and 10 injured in #Munich
If you let refugees in terrorist attacks will become common like in Europe!","[""Munich""]",[],1469210789000.0,2016-07-22 18:06:29
4355797094.0,276.0,False,295.0,Obama wants us to live in his dream world. Worst president ever and with Clinton we won't restore safety! #Munich https://t.co/TdUzpaEwy7,"[""Munich""]",[],1469216741000.0,2016-07-22 19:45:41
4355797094.0,415.0,False,305.0,Obama cracks a joke while talking about #Munich terrorist attack. He is an insult to America and all the world! https://t.co/PnKZPQArJc,"[""Munich""]",[],1469223804000.0,2016-07-22 21:43:24
4355797094.0,187.0,False,132.0,"Hillary Clinton wants to keep the people ignorant! From #DNCleaks
She is with Wall Street not with Americans! https://t.co/5HjE4uUkAt","[""DNCLeaks""]",[],1469229869000.0,2016-07-22 23:24:29
4355797094.0,17.0,False,29.0,Hillary Clinton chooses Tim Kaine as her VP pick. Who the fuck is Tim Kaine? Only nobodies are willing to work with criminal Clinton,[],[],1469233323000.0,2016-07-23 00:22:03
4355797094.0,26.0,False,37.0,"Liberal slogans are all about them #ImWithHer #YesWeKaine Pathetic!
Our slogans are about America and American people! #AmericaFirst #MAGA","[""AmericaFirst"",""YesWeKaine"",""maga"",""imwithher""]",[],1469234640000.0,2016-07-23 00:44:00
4355797094.0,133.0,False,89.0,Hillary Clinton will emulate Merkel's Germany here if she ever got power. We won't let her! #AmericaFirst https://t.co/nVB5EtXr8n,"[""AmericaFirst""]",[],1469238092000.0,2016-07-23 01:41:32
4355797094.0,140.0,False,76.0,Everything you need to know about Tim Kaine and why Hillary Clinton picked him. He is pro-TPP. Stop this nonsense! https://t.co/L14rGtJK30,[],[],1469239389000.0,2016-07-23 02:03:09
4355797094.0,46.0,False,43.0,"CNN with Obama's narrative and memorized 4 words! ""Motives were unclear"" every time a terrorists attack! https://t.co/jZvmJBH891",[],[],1469239756000.0,2016-07-23 02:09:16
4355797094.0,101.0,False,97.0,We need to take control of country. Those liberals will do everything to illegals but not for vets #VoteTrump2016 https://t.co/rpmQuuS6PV,"[""VoteTrump2016""]",[],1469244610000.0,2016-07-23 03:30:10
4355797094.0,262.0,False,320.0,The only answer to Islamic terrorism. Not sponsoring them like Obama is doing! https://t.co/7Ag7wGBO1X,[],[],1469311218000.0,2016-07-23 22:00:18
4355797094.0,56.0,False,33.0,"Bernie Sanders is a fraud! Democratic party today is full of criminals!
#FeelTheBern #VoteTrump2016 https://t.co/mqs0sW2tQv","[""feelthebern"",""VoteTrump2016""]",[],1469470684000.0,2016-07-25 18:18:04
4355797094.0,2.0,False,1.0,"From #DNCinPHL 
Democratic party is corrupt and rotten, We should bury them to build a better America #DNCmovies https://t.co/BPcgtxOJqd","[""DNCmovies"",""DNCinPHL""]",[],1469471688000.0,2016-07-25 18:34:48
4355797094.0,30.0,False,24.0,France is turning into a shithole thanks to weak immigration laws and EU regulations. We can't allow it here! https://t.co/Td3emKx2pM,[],[],1469477869000.0,2016-07-25 20:17:49
4355797094.0,157.0,False,115.0,Hillary Rotten Clinton. Imagine Obama but hundreds times worse. Corrupt Killary. #DemsInPhilly https://t.co/8J1yxN2g31,"[""DemsInPhilly""]",[],1469478369000.0,2016-07-25 20:26:09
4355797094.0,423.0,False,390.0,Hillary Rotten Clinton. History made by being too big to jail! #Hillary4Prison https://t.co/b6Sz6mYGIV,"[""Hillary4prison""]",[],1469480461000.0,2016-07-25 21:01:01
4355797094.0,978.0,False,691.0,Hillary Clinton ordered to remove Sanders sign from #DemConvention Silencing people is Clinton style #DemsInPhilly https://t.co/9hdKnuexoI,"[""DemConvention"",""DemsInPhilly""]",[],1469486053000.0,2016-07-25 22:34:13
4355797094.0,0.0,False,0.0,"CNN - Clinton News Nonsense.
And we all know from Wikileaks CNN is with DNC. Shameless propaganda https://t.co/qTL75Sn66N",[],[],1469487448000.0,2016-07-25 22:57:28
4355797094.0,191.0,False,198.0,"#DemsInPhilly have built a wall around #DemConvention 
They are for walls when it's needed for them! https://t.co/8nzKREXB7q","[""DemsInPhilly"",""DemConvention""]",[],1469493479000.0,2016-07-26 00:37:59
4355797094.0,88.0,False,65.0,Liberal rape fantasies are out of control. Sadly she will trade sane Americans fro rapists AND racists. Ignorant! https://t.co/Js1Cw1yC1S,[],[],1469495668000.0,2016-07-26 01:14:28
4355797094.0,2.0,False,0.0,"DNC breaks laws. Party of criminals! Un-American people at #DemConvention #DemsInPhilly
https://t.co/T5iaSBbo05","[""DemConvention"",""DemsInPhilly""]",[],1469498354000.0,2016-07-26 01:59:14
4355797094.0,6.0,False,8.0,"Muslim beheaded a Catholic priest today, ISIS claimed it. Democrats still refuse to see the real world #Normandy #FuckIslam","[""FuckIslam"",""Normandy""]",[],1469555359000.0,2016-07-26 17:49:19
4355797094.0,164.0,False,123.0,Bernie Sanders apparently sold out to Hillary Clinton for a private plane. #FeelTheBern #DemsInPhilly #DemConvention https://t.co/rmZSgskGhr,"[""feelthebern"",""DemsInPhilly"",""DemConvention""]",[],1469562204000.0,2016-07-26 19:43:24
4355797094.0,1.0,False,1.0,Love for walls trumps hate #DemConvention #DNCConvention #DemsInPhilly #DNCinPHL #FeelTheBern https://t.co/DWXScGEL1D,"[""DemConvention"",""DNCinPHL"",""feelthebern"",""DNCConvention"",""DemsInPhilly""]",[],1469567267000.0,2016-07-26 21:07:47
4355797094.0,114.0,False,71.0,Pledge of Allegiance had to be put on Teleprompter at #DNCConvention What an embarrassment! #DemsInPhilly #DNCinPHL https://t.co/UVqaqYOzKF,"[""DNCConvention"",""DemsInPhilly"",""DNCinPHL""]",[],1469569262000.0,2016-07-26 21:41:02
4355797094.0,159.0,False,148.0,History Made! First criminal nominee of a major party in the nation's history Hillary Clinton! #DNCinPHL https://t.co/8n8lxJgpov,"[""DNCinPHL""]",[],1469573383000.0,2016-07-26 22:49:43
4355797094.0,1.0,False,1.0,"Crowd shouts ""Hillary"" at #DNCConvention while everyone were shouting ""USA"" at #RNCinCLE 
Difference is obvious. Un-American #DemConvention","[""DemConvention"",""DNCConvention"",""RNCinCLE""]",[],1469573886000.0,2016-07-26 22:58:06
4355797094.0,116.0,False,76.0,"Lena Dunham is one of the faces of #DNCConvention 
Convention full of liars, criminals and frauds. #DemsInPhilly https://t.co/qgi3YxYAHO","[""DNCConvention"",""DemsInPhilly""]",[],1469581570000.0,2016-07-27 01:06:10
4355797094.0,188.0,False,176.0,All you need to know about Bill Clinton is on this t-shirt #DNCinPHL #DemsInPhilly #BillLovesRape https://t.co/bJDY2bHyKr,"[""DNCinPHL"",""DemsInPhilly"",""BillLovesRape""]",[],1469585486000.0,2016-07-27 02:11:26
4355797094.0,38.0,False,33.0,"Democrats can't unite, they'll never unite our country. Americans don't want criminals!
#DemsInPhilly #DemConvention https://t.co/VIUh3sYYVs","[""DemsInPhilly"",""DemConvention""]",[],1469586303000.0,2016-07-27 02:25:03
4355797094.0,168.0,False,118.0,Worst president of America. And his work is showing at #DNCinPHL https://t.co/QS7RTH6hzP,"[""DNCinPHL""]",[],1469624428000.0,2016-07-27 13:00:28
4355797094.0,9003.0,False,6508.0,"Man PROVES software stole votes in ALL 'Hillary won' counties! DNC rigged elections 
#IndictHillary #ImWithHer https://t.co/EDXogMTEFI","[""imwithher"",""IndictHillary""]",[],1469815378000.0,2016-07-29 18:02:58
4355797094.0,208.0,False,87.0,Someone noticed man walking with ISIS flag freely in Paris. Europe will never learn on their mistakes and sacrifices https://t.co/BT0i4DXuEa,[],[],1469817563000.0,2016-07-29 18:39:23
4355797094.0,594.0,False,504.0,Everyone supporting Hillary Clinton is supporting rich of Wall Street to continue exploit America #ImWithHerNow https://t.co/I4lyqYxLW9,"[""ImWithHerNow""]",[],1469829083000.0,2016-07-29 21:51:23
4355797094.0,677.0,False,507.0,Hillary Clinton is owned by George Soros. #BlackLivesMatter is owned by Soros. We must stop them together #ImWithHer https://t.co/xuksZMC9uN,"[""imwithher"",""Blacklivesmatter""]",[],1469843323000.0,2016-07-30 01:48:43
4355797094.0,42.0,False,32.0,"#3WordHillary Unfit into office

#RiggedSystem #RiggedElections Time to stop it! https://t.co/rBhkvLSJaR","[""RiggedElections"",""RiggedSystem"",""3WordHillary""]",[],1469902718000.0,2016-07-30 18:18:38
4355797094.0,126.0,False,167.0,"In God We Trust. It's 60 years since we accepted it as our National Motto. God bless America
#InGodWeTrust https://t.co/e8i31Fmu2a","[""InGodWeTrust""]",[],1469903340000.0,2016-07-30 18:29:00
4355797094.0,92.0,False,79.0,"Clinton Cash documentary movie. Everyone supporting her need to open their eyes! #ImWithHer #RiggedSystem 
https://t.co/khzFAA06Hr","[""RiggedSystem"",""imwithher""]",[],1469904971000.0,2016-07-30 18:56:11
4355797094.0,345.0,False,248.0,Democrats have no respect to American flag and American values. No way we let criminals win #AmericaFirst #MAGA https://t.co/vkS4OtBb8c,"[""maga"",""AmericaFirst""]",[],1469914456000.0,2016-07-30 21:34:16
4355797094.0,570.0,False,338.0,Clinton Campaign confiscates American flags at Pittsburgh rally and throws them on the floor. Disgusting https://t.co/vNm0pTXxBE,[],[],1469923800000.0,2016-07-31 00:10:00
4355797094.0,0.0,False,0.0,"@MtnMermaid618 yes, it's ok. You can find pictures of Bush and Obama not holding hand to heart. Also American flag is protected by law",[],[],1469930136000.0,2016-07-31 01:55:36
4355797094.0,17.0,False,15.0,@MtnMermaid618 so it's Russia's fault that DNC is a corrupted nest? Are russians were who rigged primaries for Clinton too?,[],[],1469932220000.0,2016-07-31 02:30:20
4355797094.0,118.0,False,147.0,Americans should stand against Clinton corruption #MakeAmericaGreatAgain #AmericaFirst https://t.co/KHuFYgaNDI,"[""AmericaFirst"",""MakeAmericaGreatAgain""]",[],1469977232000.0,2016-07-31 15:00:32
4355797094.0,165.0,False,183.0,No more corrupt politicians. Clintons must be the first to jail next to Obama #RiggedSystem https://t.co/DcvdqMklBe,"[""RiggedSystem""]",[],1469984429000.0,2016-07-31 17:00:29
4355797094.0,25.0,False,30.0,"CEO at Democratic National Committee resigns. Too bad it won't end total corruption within DNC #Hillary4Prison
https://t.co/K5TBiZFJ6O","[""Hillary4prison""]",[],1470165998000.0,2016-08-02 19:26:38
4355797094.0,61.0,False,46.0,"900 Syrian refugees arrested for crimes including rape and child abuse. 900! Stop accepting rapefugees
https://t.co/FU7gFY6vdz",[],[],1470167454000.0,2016-08-02 19:50:54
4355797094.0,58.0,False,58.0,Don't let our country turn into socialist shithole. Say no to Hillary Clinton and rigged system #TrumpPence16 https://t.co/IcH0sUv0i7,"[""TrumpPence16""]",[],1470169689000.0,2016-08-02 20:28:09
4355797094.0,81.0,False,62.0,"The US strategy to create a new global legal and economic system: TPP, TTIP. The only candidate against TPP is Trump
https://t.co/1eUGno5n7z",[],[],1470185254000.0,2016-08-03 00:47:34
4355797094.0,229.0,False,176.0,"Hillary Cinton ARMED ISIS and other jihadists in Syria. Wikileaks proves it. Clinton is the threat to all the world
https://t.co/3DnGbGjuXm",[],[],1470188300000.0,2016-08-03 01:38:20
4355797094.0,171.0,False,145.0,Obama's Iran deal is aimed against America. Time to get rid of the worst president and his criminal party DNC https://t.co/oNM9PnlCe6,[],[],1470251034000.0,2016-08-03 19:03:54
4355797094.0,318.0,False,318.0,Anyone who believes that sharia law is above Constitution has no right to be called American citizen https://t.co/7n1NnapR4L,[],[],1470251751000.0,2016-08-03 19:15:51
4355797094.0,69.0,False,65.0,Barack Obama will take whole October off to help Clinton campaign. He CAN'T do his job and wants his criminal friend to win! #NeverHillary,"[""NeverHillary""]",[],1470252542000.0,2016-08-03 19:29:02
4355797094.0,444.0,False,359.0,Hillary Clinton wants to RAISE TAXES for middle class. Her supporters applaud it. Idiots. #NeverHillary #ImWithHer https://t.co/cXbIjpAVsv,"[""imwithher"",""NeverHillary""]",[],1470255895000.0,2016-08-03 20:24:55
4355797094.0,422.0,False,319.0,Plane full of cash. Obama is a criminal. Put him in prison next to Hillary Clinton #IranRansomScandal https://t.co/QnAopniV6n,"[""IranRansomScandal""]",[],1470263216000.0,2016-08-03 22:26:56
