user_id,retweet_count,retweeted,favorite_count,text,hashtags,mentions,created_at,created_str
3071479646.0,1.0,False,0.0,Bush trashes Trump on eve of GOP convention https://t.co/oJjTfbOCuA #politics | https://t.co/cdnQqWB38H https://t.co/TwoBHA1ki4,"[""Politics"",""Politics""]",[],1468684638000.0,2016-07-16 15:57:18
3071479646.0,1.0,False,0.0,#Breaking: New faces at GOP convention could shape party's future https://t.co/C92fZbxt0V,"[""breaking""]",[],1468691363000.0,2016-07-16 17:49:23
3071479646.0,6.0,False,1.0,Cleveland on edge as Republicans arrive for convention https://t.co/JSwo57EeGO | https://t.co/cdnQqWB38H https://t.co/Ct2QbOj6pU,[],[],1468832256000.0,2016-07-18 08:57:36
3071479646.0,0.0,False,0.0,Pence in 1997: Working mothers stunt emotional growth of ch... https://t.co/flrvaA6s7q | https://t.co/cdnQqWB38H https://t.co/MO9kn6qzJ9,[],[],1468897049000.0,2016-07-19 02:57:29
3071479646.0,0.0,False,0.0,"Chaos On RNC Floor As GOP Officials Dismiss #NeverTrump Delegates
https://t.co/M2zAPxDpd6 https://t.co/JiQwzYcv4J","[""NeverTrump""]",[],1468901787000.0,2016-07-19 04:16:27
3071479646.0,0.0,False,0.0,More Baton Rouges' Could Elect Trump https://t.co/eae59H16Yi | https://t.co/cdnQqWB38H https://t.co/Td1VgoY7J8,[],[],1468916688000.0,2016-07-19 08:24:48
3071479646.0,1.0,False,0.0,Maryland delegates dismiss plagiarism claims in Melania Trump's address https://t.co/v5EuKOLbJn,[],[],1468943848000.0,2016-07-19 15:57:28
3071479646.0,0.0,False,0.0,GOP Congressman Stands By Argument That White People Contri... https://t.co/zOsoI5MI8c | https://t.co/cdnQqWB38H https://t.co/xVyZ7DF8NC,[],[],1468959880000.0,2016-07-19 20:24:40
3071479646.0,0.0,False,0.0,Donald Trump plan will break up big banks https://t.co/yyMCTeCF9X #politics | https://t.co/cdnQqWB38H https://t.co/Wirii6fe5a,"[""Politics"",""Politics""]",[],1468961859000.0,2016-07-19 20:57:39
3071479646.0,0.0,False,0.0,Analyst: RNC missed chance to bridge divide https://t.co/DiSMmgZRYU,[],[],1468965577000.0,2016-07-19 21:59:37
3071479646.0,0.0,False,0.0,"Melania Trump plagiarism charge underscores concerns with campaign
https://t.co/fAk4CAHanf https://t.co/4P0wZ8NNrl",[],[],1468988875000.0,2016-07-20 04:27:55
3071479646.0,0.0,False,0.0,RNC official cites 'My Little Pony' to defend Melania Trump https://t.co/HcU7TTxApe | https://t.co/cdnQqWB38H https://t.co/oTchg7CBxk,[],[],1469005053000.0,2016-07-20 08:57:33
3071479646.0,0.0,False,0.0,#Breaking: Ocean City business grounds Trump airplane banners https://t.co/43ZpnhK4tS,"[""breaking""]",[],1469016786000.0,2016-07-20 12:13:06
3071479646.0,1.0,False,0.0,Tavis Smiley Calls Out RNC Sheriff Speaker For Black Lives ... https://t.co/JxHuiCLoN9 | https://t.co/cdnQqWB38H https://t.co/DPVhzMbGJT,[],[],1469024692000.0,2016-07-20 14:24:52
3071479646.0,0.0,False,0.0,Day 2 of GOP convention speeches: CNN vets the claims https://t.co/EO7sTtNOUd | https://t.co/cdnQqWB38H https://t.co/ObFptolcLl,[],[],1469028263000.0,2016-07-20 15:24:23
3071479646.0,0.0,False,0.0,In ’Murica News: RNC’s 5 Worst Moments So Far https://t.co/lbRUfV9YDu | https://t.co/cdnQqWB38H,[],[],1469110891000.0,2016-07-21 14:21:31
3071479646.0,0.0,False,0.0,"RNC Day 3: Cruz booed, Pence nominated https://t.co/eNtrij2gxS #politics | https://t.co/cdnQqWB38H https://t.co/IvUN40jar4","[""Politics"",""Politics""]",[],1469111074000.0,2016-07-21 14:24:34
3071479646.0,0.0,False,0.0,Donald Trump accepts GOP presidential nod; references Baltimore homicides in speech https://t.co/Ac223dzu6m,[],[],1469165649000.0,2016-07-22 05:34:09
3071479646.0,0.0,False,0.0,Hillary Clinton hate for sale on the streets of Cleveland https://t.co/jRMFrCJ35O | https://t.co/cdnQqWB38H https://t.co/DpyXgMaiaU,[],[],1469175878000.0,2016-07-22 08:24:38
3071479646.0,0.0,False,0.0,RNC Day 4: Trump becomes nominee https://t.co/hzqGKkLDNn #politics | https://t.co/cdnQqWB38H https://t.co/agBybgWYEl,"[""Politics"",""Politics""]",[],1469197472000.0,2016-07-22 14:24:32
3071479646.0,0.0,False,0.0,Obama: Trump's doom-and-gloom doesn't match reality https://t.co/KBNUQds8Wc #politics | https://t.co/cdnQqWB38H https://t.co/hqACItbXXe,"[""Politics"",""Politics""]",[],1469283880000.0,2016-07-23 14:24:40
3071479646.0,0.0,False,0.0,"Trump, Warren reignite feud in wake of Kaine VP selection https://t.co/hGy4Iil2F1 | https://t.co/cdnQqWB38H https://t.co/cltJe4od3j",[],[],1469327075000.0,2016-07-24 02:24:35
3071479646.0,0.0,False,0.0,Why Twitter Lost Its Mind Over These ‘Hispanic Para Trump' ... https://t.co/CG7hI3AvP5 | https://t.co/cdnQqWB38H https://t.co/enbCwz3t8e,[],[],1469368960000.0,2016-07-24 14:02:40
3071479646.0,0.0,False,0.0,WikiLeaks emails reveal DeRay Mckesson was vetted as a potential DNC surrogate https://t.co/ExB1syFioQ,[],[],1469412392000.0,2016-07-25 02:06:32
3071479646.0,0.0,False,0.0,#Breaking: WikiLeaks emails reveal DeRay Mckesson was vetted as a potential DNC surrogate https://t.co/fvHOgscAGk,"[""breaking""]",[],1469413269000.0,2016-07-25 02:21:09
3071479646.0,0.0,False,0.0,Trump rebukes David Duke 'as quick as you can say it' https://t.co/Pge5dysuQU | https://t.co/cdnQqWB38H https://t.co/OQURf3uVQ2,[],[],1469413475000.0,2016-07-25 02:24:35
3071479646.0,0.0,False,0.0,Michael Bloomberg to endorse Hillary Clinton https://t.co/c3lrcPNY6H #politics | https://t.co/cdnQqWB38H https://t.co/D0x68hg6qt,"[""Politics"",""Politics""]",[],1469435077000.0,2016-07-25 08:24:37
3071479646.0,0.0,False,0.0,Maryland delegation set to attend DNC https://t.co/klSGPcLu6W,[],[],1469446412000.0,2016-07-25 11:33:32
3071479646.0,0.0,False,0.0,"Some Republicans Think, Fingers Crossed, That Trump Could M... https://t.co/qwM7gScjz3 | https://t.co/cdnQqWB38H https://t.co/KC0x3txzAJ",[],[],1469455382000.0,2016-07-25 14:03:02
3071479646.0,0.0,False,0.0,Clinton's campaign manager: Russia helping Trump https://t.co/on3lUqWtPO #politics | https://t.co/cdnQqWB38H https://t.co/0KdzZit8pm,"[""Politics"",""Politics""]",[],1469456680000.0,2016-07-25 14:24:40
3071479646.0,0.0,False,0.0,Baltimore mayor to gavel in DNC https://t.co/bqTz4YeykD,[],[],1469472181000.0,2016-07-25 18:43:01
3071479646.0,0.0,False,0.0,Stephanie Rawlings-Blake will gavel in Democratic National Convention https://t.co/mgKvJJFGDi,[],[],1469474688000.0,2016-07-25 19:24:48
3071479646.0,0.0,False,0.0,Baltimore mayor gavels in DNC https://t.co/bqTz4YeykD,[],[],1469480605000.0,2016-07-25 21:03:25
3071479646.0,0.0,False,0.0,"Elijah Cummings, Steny Hoyer among Marylanders addressing DNC https://t.co/9g6LYbKfEM",[],[],1469490775000.0,2016-07-25 23:52:55
3071479646.0,0.0,False,0.0,"#Breaking: After silence, O'Malley re-emerges at Democratic convention https://t.co/VGpljfGf2S","[""breaking""]",[],1469496368000.0,2016-07-26 01:26:08
3071479646.0,0.0,False,0.0,America Ferrera Breaks Down Why Latino Trump Supporters Exist https://t.co/7mQ5nydD44 | https://t.co/cdnQqWB38H https://t.co/tiTXmXq8CO,[],[],1469520160000.0,2016-07-26 08:02:40
3071479646.0,0.0,False,0.0,"Democracy Spring plans mass sit-in, arrests at DNC https://t.co/D1C9Hb5wEI #politics | https://t.co/cdnQqWB38H https://t.co/ACLJ30p17h","[""Politics"",""Politics""]",[],1469521479000.0,2016-07-26 08:24:39
3071479646.0,7.0,False,8.0,16-Year-Old From Compton Becomes Youngest Black Pilot To Fl... https://t.co/NUSHKCDGjV | https://t.co/cdnQqWB38H https://t.co/FvmgtP0dPE,[],[],1469541762000.0,2016-07-26 14:02:42
3071479646.0,2.0,False,1.0,Dumb Rapper Shoots Himself In the Face for Fame https://t.co/zYzyxmjqKr | https://t.co/cdnQqWB38H,[],[],1469542882000.0,2016-07-26 14:21:22
3071479646.0,0.0,False,0.0,Memorable lines from the DNC's opening night https://t.co/htLsKkQtU9 #politics | https://t.co/cdnQqWB38H https://t.co/1PMsRO2nzc,"[""Politics"",""Politics""]",[],1469543081000.0,2016-07-26 14:24:41
3071479646.0,0.0,False,0.0,Stephanie Rawlings-Blake says Trump 'doesn't understand' crime fighting https://t.co/EZdHYiWgIf,[],[],1469552221000.0,2016-07-26 16:57:01
3071479646.0,0.0,False,0.0,Baltimore mayor on Donald Trump: 'Shameful' https://t.co/hNkJafTKjR,[],[],1469566902000.0,2016-07-26 21:01:42
3071479646.0,0.0,False,0.0,Indiana GOP taps Holcomb to replace Pence https://t.co/2quI4BaGyB #politics | https://t.co/cdnQqWB38H https://t.co/xpynS7z1N6,"[""Politics"",""Politics""]",[],1469570301000.0,2016-07-26 21:58:21
3071479646.0,0.0,False,0.0,"Cory Booker responds to Trump: 'I love you, Donald' https://t.co/x79ruSSVdu #politics | https://t.co/cdnQqWB38H https://t.co/jCpeamgEeO","[""Politics"",""Politics""]",[],1469588310000.0,2016-07-27 02:58:30
3071479646.0,0.0,False,0.0,Obama: 'Possible' Putin trying to sway vote for Trump https://t.co/UJ3Ii0gIAx | https://t.co/cdnQqWB38H https://t.co/35BRKV3XLo,[],[],1469609913000.0,2016-07-27 08:58:33
3071479646.0,0.0,False,0.0,Viewers guide to the Democratic convention https://t.co/HHr8oS9goL #politics | https://t.co/cdnQqWB38H https://t.co/WCEVqWrXyz,"[""Politics"",""Politics""]",[],1469612538000.0,2016-07-27 09:42:18
3071479646.0,0.0,False,0.0,Trump Supporter Yells Racist Slurs at Black Woman on Subway https://t.co/gdceBP3iQD | https://t.co/cdnQqWB38H,[],[],1469612655000.0,2016-07-27 09:44:15
3071479646.0,0.0,False,0.0,Martin O'Malley to speak at DNC tonight https://t.co/PfUU9g7Idq,[],[],1469623644000.0,2016-07-27 12:47:24
3071479646.0,0.0,False,0.0,Trump says he'd support $10 minimum wage https://t.co/258xr0P5L4 #politics | https://t.co/cdnQqWB38H https://t.co/6DhXyNAThs,"[""Politics"",""Politics""]",[],1469630563000.0,2016-07-27 14:42:43
3071479646.0,0.0,False,0.0,Rawlings-Blake disagrees with Mosby criticism of criminal justice system https://t.co/tpirc1RrkZ,[],[],1469652342000.0,2016-07-27 20:45:42
3071479646.0,0.0,False,0.0,"'Little doubt' Russia behind DNC hack, US official says https://t.co/eRG1m2vtzE | https://t.co/cdnQqWB38H https://t.co/eAAmsqbIPm",[],[],1469653873000.0,2016-07-27 21:11:13
3071479646.0,0.0,False,0.0,#Breaking: Martin O'Malley hits Donald Trump's 'American nightmare' https://t.co/b3Ja99WpJ9,"[""breaking""]",[],1469664597000.0,2016-07-28 00:09:57
3071479646.0,0.0,False,0.0,Memorable lines from DNC Day 3 https://t.co/bGysOtK1P0 #politics | https://t.co/cdnQqWB38H https://t.co/cfBJczrkK0,"[""Politics"",""Politics""]",[],1469693501000.0,2016-07-28 08:11:41
3071479646.0,0.0,False,0.0,6 takeaways from DNC Day 3 https://t.co/NPrYBky5Xu #politics | https://t.co/cdnQqWB38H https://t.co/E3P6TwXtqQ,"[""Politics"",""Politics""]",[],1469715090000.0,2016-07-28 14:11:30
3071479646.0,0.0,False,0.0,"Hillary Clinton, Barbara Mikulski to speak tonight at Democratic Convention https://t.co/KP5CszAdmd",[],[],1469723595000.0,2016-07-28 16:33:15
3071479646.0,0.0,False,0.0,Hillary Clinton's challenge: Igniting excitement https://t.co/EnEy8thY0g #politics | https://t.co/cdnQqWB38H https://t.co/Ysej7jk9FL,"[""Politics"",""Politics""]",[],1469741006000.0,2016-07-28 21:23:26
3071479646.0,0.0,False,0.0,"#Election2016: Trump Ain’t New, and Clinton Ain’t Savior https://t.co/XgXYROX44M | https://t.co/cdnQqWB38H","[""Election2016"",""Election2016""]",[],1469758714000.0,2016-07-29 02:18:34
3071479646.0,0.0,False,0.0,NC GOP apologizes to Tim Kaine over tweet https://t.co/rCNG40wRfh #politics | https://t.co/cdnQqWB38H https://t.co/UUNiEC1vTi,"[""Politics"",""Politics""]",[],1469759014000.0,2016-07-29 02:23:34
3071479646.0,1.0,False,0.0,The Only 'Make America Great' Hat You Really Need This Election https://t.co/OVOe867gTX | https://t.co/cdnQqWB38H https://t.co/XjO7JjwUOp,[],[],1469780797000.0,2016-07-29 08:26:37
3071479646.0,0.0,False,0.0,'Feminist Christmas': World reacts to Democratic convention https://t.co/uZgfl6rjVi | https://t.co/cdnQqWB38H https://t.co/5OoN3OMvIs,[],[],1469802221000.0,2016-07-29 14:23:41
3071479646.0,0.0,False,0.0,Kaine describes 'emotional moment' of Clinton's speech https://t.co/55q4u2ciYr | https://t.co/cdnQqWB38H https://t.co/gzOWG7PtFB,[],[],1469823810000.0,2016-07-29 20:23:30
3071479646.0,0.0,False,0.0,Clinton bus tour looks for inroads with GOP https://t.co/rppyhdnm1u #politics | https://t.co/cdnQqWB38H https://t.co/lhwKoU9zuV,"[""Politics"",""Politics""]",[],1469867016000.0,2016-07-30 08:23:36
3071479646.0,0.0,False,0.0,"Clinton, Kaine stump together after conventions https://t.co/zLQvGsPSLf #politics | https://t.co/cdnQqWB38H https://t.co/40SUj1yRO7","[""Politics"",""Politics""]",[],1469888619000.0,2016-07-30 14:23:39
3071479646.0,1.0,False,0.0,FBI turns over thousands of Clinton documents to State Depa... https://t.co/Q3sypXwSZr | https://t.co/cdnQqWB38H https://t.co/v7Z55uMoGx,[],[],1469975021000.0,2016-07-31 14:23:41
3071479646.0,1.0,False,0.0,114 Colorado Professors Condemn Donald Trump's Rhetoric As ... https://t.co/oBq2vVQK35 | https://t.co/cdnQqWB38H https://t.co/SclNedT92z,[],[],1469975197000.0,2016-07-31 14:26:37
3071479646.0,0.0,False,0.0,"Trump says Putin is 'not going to go into Ukraine,' despite... https://t.co/B0xvvF3UBn | https://t.co/cdnQqWB38H https://t.co/W4sjcpL2zW",[],[],1469996621000.0,2016-07-31 20:23:41
3071479646.0,0.0,False,0.0,People Are Upset (Yawn) That Malia Obama Skipped The DNC Fo... https://t.co/aDYLfkimpX | https://t.co/cdnQqWB38H https://t.co/mRhXzqFulH,[],[],1469996788000.0,2016-07-31 20:26:28
3071479646.0,0.0,False,0.0,"Trump adviser: Melania nude picture ""nothing to be embarras... https://t.co/5Uhbh8jY4d | https://t.co/cdnQqWB38H https://t.co/Bb9ieLNwZX",[],[],1470018210000.0,2016-08-01 02:23:30
3071479646.0,0.0,False,0.0,Charles Koch on speculation he would vote for Clinton: 'Tha... https://t.co/4j1yyGC17s | https://t.co/cdnQqWB38H https://t.co/SOq0hznAiZ,[],[],1470039815000.0,2016-08-01 08:23:35
3071479646.0,0.0,False,0.0,"#Breaking: Here, Mr. Trump, this is what sacrifice looks like https://t.co/iKbQ7yHgFr","[""breaking""]",[],1470050337000.0,2016-08-01 11:18:57
3071479646.0,0.0,False,0.0,Gold Star families demand apology from Trump https://t.co/hSOJpQqYQV #politics | https://t.co/cdnQqWB38H https://t.co/XDoIiXQnrx,"[""Politics"",""Politics""]",[],1470061418000.0,2016-08-01 14:23:38
3071479646.0,0.0,False,0.0,"While Khan talks peace, Trump tweets against him https://t.co/X9rK4683pE #politics | https://t.co/cdnQqWB38H https://t.co/P9M7RQwEh5","[""Politics"",""Politics""]",[],1470083007000.0,2016-08-01 20:23:27
3071479646.0,0.0,False,0.0,Obama: No one's given more than Gold Star families https://t.co/Q0V3SGznYY #politics | https://t.co/cdnQqWB38H https://t.co/mJtRxKe2r4,"[""Politics"",""Politics""]",[],1470104612000.0,2016-08-02 02:23:32
3071479646.0,0.0,False,0.0,Post-convention poll: Clinton retakes lead over Trump https://t.co/MTMjFWvdIQ | https://t.co/cdnQqWB38H https://t.co/msBsQwDgSF,[],[],1470126214000.0,2016-08-02 08:23:34
3071479646.0,0.0,False,0.0,Russia continues to shadow Trump https://t.co/qPVknVlRdk #politics | https://t.co/cdnQqWB38H https://t.co/vqdzE7fLAW,"[""Politics"",""Politics""]",[],1470147818000.0,2016-08-02 14:23:38
3071479646.0,0.0,False,0.0,Trump says he 'got out' of stock market https://t.co/NSvoZMvGmB #politics | https://t.co/cdnQqWB38H https://t.co/C3dMXLVk5f,"[""Politics"",""Politics""]",[],1470169422000.0,2016-08-02 20:23:42
3071479646.0,0.0,False,0.0,Trump responds to Obama: 'He's a terrible president' https://t.co/6VMKm8RsJj #politics | https://t.co/cdnQqWB38H https://t.co/RWA0jiQvso,"[""Politics"",""Politics""]",[],1470217818000.0,2016-08-03 09:50:18
3071479646.0,1.0,False,1.0,Eric Trump: Ivanka would not allow herself to be sexually h... https://t.co/lKFMLx7p65 | https://t.co/cdnQqWB38H https://t.co/lo9EdEAopK,[],[],1470238216000.0,2016-08-03 15:30:16
3071479646.0,1.0,False,0.0,Rawlings-Blake criticizes Trump's decision to skip Urban League conference https://t.co/Q5KE9Fl0Q4,[],[],1470251371000.0,2016-08-03 19:09:31
3071479646.0,0.0,False,0.0,"Clinton, Trump supporters have few friends on other side https://t.co/H1VSKpAq80 | https://t.co/cdnQqWB38H https://t.co/9ExyT9u33W",[],[],1470256238000.0,2016-08-03 20:30:38
3071479646.0,0.0,False,0.0,Buffett: A monkey could outperform those who bet on Trump's... https://t.co/QTbvDeVliT | https://t.co/cdnQqWB38H https://t.co/UsLLWvgAF5,[],[],1470299432000.0,2016-08-04 08:30:32
3071479646.0,0.0,False,0.0,Here's An Easy Way To Defeat Trump: Refuse To Sleep With Hi... https://t.co/5w1EOCyms5 | https://t.co/cdnQqWB38H https://t.co/e89yOMOelg,[],[],1470299444000.0,2016-08-04 08:30:44
3071479646.0,0.0,False,0.0,Kaine to address National Urban League conference https://t.co/B6fwMspoVr,[],[],1470317443000.0,2016-08-04 13:30:43
3071479646.0,0.0,False,0.0,"In Baltimore, Tim Kaine vows to be partner for cities https://t.co/NFzMZcczFS",[],[],1470333675000.0,2016-08-04 18:01:15
3071479646.0,1.0,False,1.0,Battleground polls: Clinton tops Trump post-convention https://t.co/KkLlNLofgT | https://t.co/cdnQqWB38H https://t.co/PIqymPPPiK,[],[],1470343828000.0,2016-08-04 20:50:28
3071479646.0,0.0,False,0.0,"GOP congressman on Trump: 'Honestly, I don't care for him much' https://t.co/xEfgu02j3G | https://t.co/cdnQqWB38H https://t.co/9iQBUfjZNn",[],[],1470367829000.0,2016-08-05 03:30:29
3071479646.0,0.0,False,0.0,Clinton's lead over Trump grows in new national polls https://t.co/7rahf6qyYF | https://t.co/cdnQqWB38H https://t.co/FbVSFDJrQL,[],[],1470389173000.0,2016-08-05 09:26:13
3071479646.0,0.0,False,0.0,Trump backs off false Iran video claim https://t.co/PTfeWPPtxd #politics | https://t.co/cdnQqWB38H https://t.co/9P59h4svNa,"[""Politics"",""Politics""]",[],1470407182000.0,2016-08-05 14:26:22
3071479646.0,0.0,False,0.0,"County GOP apologizes for ""Ready for Hillary"" executioner tweet https://t.co/ZQfeRBoPwH | https://t.co/cdnQqWB38H https://t.co/14LSCtb7a9",[],[],1470433526000.0,2016-08-05 21:45:26
3071479646.0,0.0,False,0.0,Only 1 Percent Of Black Voters Support Donald Trump https://t.co/lEaDNCrKiJ | https://t.co/cdnQqWB38H https://t.co/lbnFGivhbc,[],[],1470451293000.0,2016-08-06 02:41:33
3071479646.0,0.0,False,0.0,Donald Trump reveals his economic advisers https://t.co/yHbFrrg67t #politics | https://t.co/cdnQqWB38H https://t.co/YF1sT3yaFx,"[""Politics"",""Politics""]",[],1470451533000.0,2016-08-06 02:45:33
3071479646.0,0.0,False,0.0,Obama: Team USA 'Sets The Gold Standard' With Its Diversity https://t.co/Z3W5V0AjvL | https://t.co/cdnQqWB38H https://t.co/mtRFEZr4W7,[],[],1470538223000.0,2016-08-07 02:50:23
3071479646.0,0.0,False,0.0,"#Breaking: One killed, two injured in overnight shootings in Baltimore https://t.co/uIgIlESOSb","[""breaking""]",[],1470575857000.0,2016-08-07 13:17:37
3071479646.0,0.0,False,0.0,Rawlings-Blake to Trump on Twitter: 'Girl bye' https://t.co/vGTw2ZH7Uh,[],[],1470587044000.0,2016-08-07 16:24:04
3071479646.0,0.0,False,0.0,Rawlings-Blake to Trump on Twitter: 'Girl bye' https://t.co/vGTw2ZH7Uh #politics,"[""Politics""]",[],1470587045000.0,2016-08-07 16:24:05
3071479646.0,0.0,False,0.0,Rawlings-Blake to Trump on Twitter: 'Girl bye' https://t.co/67XJ6cQzAn,[],[],1470589067000.0,2016-08-07 16:57:47
3071479646.0,0.0,False,0.0,Federal police investigations part of Obama legacy https://t.co/SrTFzAKfDM,[],[],1470800539000.0,2016-08-10 03:42:19
3071479646.0,0.0,False,0.0,MLK's Daughter Is 'Disgusted' By Trump's Assassination Comment https://t.co/1EyfdoLSyN | https://t.co/cdnQqWB38H https://t.co/HmYszFxbnP,[],[],1470862291000.0,2016-08-10 20:51:31
3071479646.0,1.0,False,0.0,Hillary Clinton campaign responds to Justice Department investigation into Baltimore police https://t.co/5ZFfr1HO5m,[],[],1470920896000.0,2016-08-11 13:08:16
3071479646.0,1.0,False,0.0,Hillary Clinton campaign responds to Justice Department investigation into Baltimore police https://t.co/5ZFfr1HO5m #politics,"[""Politics""]",[],1470920896000.0,2016-08-11 13:08:16
3071479646.0,2.0,False,0.0,The Most Controversial Art Of The 2016 Election So Far https://t.co/3UuOnMGqjS | https://t.co/cdnQqWB38H https://t.co/TH2GaV9pYv,[],[],1471035089000.0,2016-08-12 20:51:29
3071479646.0,0.0,False,0.0,The GOP Hires Black ‘Suicide Squad’ to Save It From Trump https://t.co/a6yV7X2rt2 | https://t.co/cdnQqWB38H,[],[],1471056151000.0,2016-08-13 02:42:31
3071479646.0,0.0,False,0.0,A Black Man’s Coming of Age in the Age of Obama https://t.co/6Sov32DhNZ | https://t.co/cdnQqWB38H,[],[],1471401929000.0,2016-08-17 02:45:29
3071479646.0,0.0,False,0.0,This Naked Donald Trump Statue Cannot Be Unseen https://t.co/mVi3JMidOJ | https://t.co/cdnQqWB38H https://t.co/2tLxTMyvFP,[],[],1471551522000.0,2016-08-18 20:18:42
3071479646.0,0.0,False,0.0,Why Trump Can Win https://t.co/6WIJb906zK | https://t.co/cdnQqWB38H https://t.co/mie4uuaGXF,[],[],1471573109000.0,2016-08-19 02:18:29
3071479646.0,0.0,False,0.0,37 Times Donald Trump Should Have Apologized https://t.co/mieebMaHQo | https://t.co/cdnQqWB38H https://t.co/pRrEcaZtMJ,[],[],1471702719000.0,2016-08-20 14:18:39
3071479646.0,0.0,False,0.0,"With Republican Gov. Larry Hogan at convention, GOP fundraising gets boost https://t.co/FbxaKkQUyI",[],[],1471722005000.0,2016-08-20 19:40:05
3071479646.0,0.0,False,0.0,What Madness Trump Hath Wrought https://t.co/OLk1uSvNgV | https://t.co/cdnQqWB38H https://t.co/J9VeG3qyTf,[],[],1471745923000.0,2016-08-21 02:18:43
3071479646.0,0.0,False,0.0,"Trump Ask ""What Have You Got To Lose!?"" https://t.co/cnmjlVbqjc | https://t.co/cdnQqWB38H https://t.co/gKve6sT0eD",[],[],1471832322000.0,2016-08-22 02:18:42
3071479646.0,0.0,False,0.0,Donald Trump Spends All of a Minute ‘Helping’ La. Flood Victims https://t.co/vBqilVJAYc | https://t.co/cdnQqWSExh,[],[],1471855526000.0,2016-08-22 08:45:26
3071479646.0,0.0,False,0.0,Donald Trump's Presidential Candidacy In One Easy-To-Follow... https://t.co/LAwALtfzZX | https://t.co/cdnQqWB38H https://t.co/Tf8FE8g1HZ,[],[],1471983523000.0,2016-08-23 20:18:43
3071479646.0,0.0,False,0.0,"Yep, Donald Trump Was Once Popular Among African-Americans https://t.co/kPXPCVZcff | https://t.co/cdnQqWSExh https://t.co/0RmqnmCntv",[],[],1472313437000.0,2016-08-27 15:57:17
3071479646.0,0.0,False,0.0,What Portraying Michelle Obama Taught Tika Sumpter About Em... https://t.co/N89GLZn9sr | https://t.co/cdnQqWB38H https://t.co/kFi62A2rFz,[],[],1472399541000.0,2016-08-28 15:52:21
3071479646.0,0.0,False,0.0,Don Cheadle Calls Trump ‘POS’ for Exploitation of Dwyane Wa... https://t.co/Qp5nzjDLGE | https://t.co/cdnQqWSExh,[],[],1472421368000.0,2016-08-28 21:56:08
3071479646.0,0.0,False,0.0,Ice Cube Takes Down Donald Trump In 1 Devastating Tweet https://t.co/EBF1UMWS1v | https://t.co/cdnQqWSExh https://t.co/w5PiDagxrT,[],[],1472440159000.0,2016-08-29 03:09:19
3071479646.0,0.0,False,0.0,Donald Trump Suggests Colin Kaepernick 'Find A New Country'... https://t.co/0sUpqWCw2b | https://t.co/cdnQqWB38H https://t.co/LGLJy6SFxC,[],[],1472571320000.0,2016-08-30 15:35:20
3071479646.0,0.0,False,0.0,Donald Trump’s Lack Of Support Among Black Voters Isn’t Unu... https://t.co/piFDwYePT7 | https://t.co/cdnQqWB38H https://t.co/EbKUtyfNDA,[],[],1472592927000.0,2016-08-30 21:35:27
3071479646.0,0.0,False,0.0,Trump Surrogate Questions MSNBC Host’s Ancestry While Defen... https://t.co/1QS3YTMAfA | https://t.co/cdnQqWB38H https://t.co/sHDTtKpRQx,[],[],1472614530000.0,2016-08-31 03:35:30
3071479646.0,0.0,False,0.0,David Duke And His Pals Loved Trump's Immigration Speech https://t.co/Jdu9FUcEPx | https://t.co/cdnQqWB38H https://t.co/geuKRrMSTt,[],[],1472742147000.0,2016-09-01 15:02:27
3071479646.0,0.0,False,0.0,Donald Trump Meets With Mexican President Enrique Peña Niet... https://t.co/W9BsVz9Kav | https://t.co/cdnQqWB38H,[],[],1472788329000.0,2016-09-02 03:52:09
3071479646.0,0.0,False,0.0,Trump Met With A Few Black Leaders In Philadelphia. The Pub... https://t.co/Kwo4rlOV4v | https://t.co/cdnQqWB38H https://t.co/mFXKVxYixC,[],[],1472960119000.0,2016-09-04 03:35:19
3071479646.0,0.0,False,0.0,This May Be Donald Trump's Most Shameless 'Pivot' Yet https://t.co/WrPeGcIL0a | https://t.co/cdnQqWB38H https://t.co/7TwpCC3XYB,[],[],1473003329000.0,2016-09-04 15:35:29
3071479646.0,0.0,False,0.0,At Least A Few Black Churchgoers Liked Donald Trump’s Detro... https://t.co/HJUDrXNQIE | https://t.co/cdnQqWB38H https://t.co/e4ARzqwsCm,[],[],1473068125000.0,2016-09-05 09:35:25
3071479646.0,0.0,False,0.0,'The Daily Show' Dissects Donald Trump's Attempts To Win Black ... https://t.co/2cc7jNKjU5 | https://t.co/cdnQqWB38H https://t.co/0jeD5wWv1a,[],[],1473261563000.0,2016-09-07 15:19:23
3071479646.0,0.0,False,0.0,Donald Trump to campaign in Maryland https://t.co/g6oz4cKa7y,[],[],1473435317000.0,2016-09-09 15:35:17
3071479646.0,0.0,False,0.0,Donald Trump to campaign in Maryland https://t.co/ZZFK9WLY8M,[],[],1473445372000.0,2016-09-09 18:22:52
3071479646.0,0.0,False,0.0,#Breaking: Donald Trump to campaign in Maryland https://t.co/WmOt7fABur,"[""breaking""]",[],1473445482000.0,2016-09-09 18:24:42
3071479646.0,0.0,False,0.0,Donald Trump to campaign in Maryland https://t.co/WmOt7fABur #breaking,"[""breaking""]",[],1473445483000.0,2016-09-09 18:24:43
3071479646.0,0.0,False,0.0,"Police urge Trump supporters, opponents to remain civil as candidate visits Baltimore https://t.co/FUAB1WvQPX",[],[],1473691419000.0,2016-09-12 14:43:39
3071479646.0,0.0,False,0.0,Text of Trump address to the National Guard Association of the United States https://t.co/58o1tmO8KW,[],[],1473704499000.0,2016-09-12 18:21:39
3071479646.0,0.0,False,0.0,#Breaking: Text of Trump address to the National Guard Association of the United States https://t.co/OBWorxepa6,"[""breaking""]",[],1473704625000.0,2016-09-12 18:23:45
3071479646.0,0.0,False,0.0,Text of Trump address to the National Guard Association of the United States https://t.co/OBWorxepa6 #breaking,"[""breaking""]",[],1473704625000.0,2016-09-12 18:23:45
3071479646.0,0.0,False,0.0,"Trump supporters, protesters confront each other in Baltimore https://t.co/8khwFFXxrU",[],[],1473712699000.0,2016-09-12 20:38:19
3071479646.0,0.0,False,0.0,"Trump supporters, protesters confront each other in Baltimore https://t.co/8khwFFFWAm",[],[],1473712700000.0,2016-09-12 20:38:20
