user_id,retweet_count,retweeted,favorite_count,text,hashtags,mentions,created_at,created_str
1646999972.0,,,,http://t.co/8hwnyWcOQX,[],[],1420551591000.0,2015-01-06 13:39:51
1646999972.0,,,,http://t.co/dIgF9QtY0v,[],[],1420551608000.0,2015-01-06 13:40:08
1646999972.0,,,,http://t.co/aytyBPOVo5,[],[],1420551621000.0,2015-01-06 13:40:21
1646999972.0,,,,Defeat is not defeat unless accepted as a reality-in your own mind.,[],[],1420555124000.0,2015-01-06 14:38:44
1646999972.0,,,,"So wake me up when it's all over, when I'm wiser and I'm older. All this time I was finding myself and I didn't know I was lost.",[],[],1420555188000.0,2015-01-06 14:39:48
1646999972.0,,,,"If we ever forget that we're one nation under God, then we will be one nation gone under.  – Ronald Reagan",[],[],1420555313000.0,2015-01-06 14:41:53
1646999972.0,,,,All mankind love a lover.,[],[],1420555425000.0,2015-01-06 14:43:45
1646999972.0,,,,"Sometimes people with the best intentions don't realize how racist they seem.Accidental Racism ,Will Make You Cringe",[],[],1420555453000.0,2015-01-06 14:44:13
1646999972.0,,,,#Rounders #MikeMcDermott: If you had it to do all over again..#movie #quote #quotes #MattDamon,"[""Rounders""]",[],1420555462000.0,2015-01-06 14:44:22
1646999972.0,,,,"Though we perceive ourselves as separate from each other, we are at our essence one,all here together,now and forever",[],[],1420555705000.0,2015-01-06 14:48:25
1646999972.0,,,,ZOMBIE APOCALYPSE : Ebola victims in African village ‘rise from the dead’,[],[],1420555715000.0,2015-01-06 14:48:35
1646999972.0,,,,A life is not important except in the impact it has on other lives. -Jackie Robinson,[],[],1420556047000.0,2015-01-06 14:54:07
1646999972.0,,,,« Riches do not exhilarate us so much with their possession as they torment us with their loss. » Epicurus,[],[],1420556180000.0,2015-01-06 14:56:20
1646999972.0,,,,"How you make others feel about themselves, says a lot about you.",[],[],1420556350000.0,2015-01-06 14:59:10
1646999972.0,,,,It's hard to hear your name when I haven't seen you in so long.,[],[],1420556353000.0,2015-01-06 14:59:13
1646999972.0,,,,I wonder what it feels like to be one of those pretty girls that all the guys want,[],[],1420556505000.0,2015-01-06 15:01:45
1646999972.0,,,,A pretty face has no value if there's no goodness in the heart.,[],[],1420556744000.0,2015-01-06 15:05:44
1646999972.0,,,,RT if you're ripping that Hustle gang,[],[],1420556759000.0,2015-01-06 15:05:59
1646999972.0,,,,Take care of your body. It's the only place you have to live.,[],[],1420557028000.0,2015-01-06 15:10:28
1646999972.0,,,,He who breaks a thing to find out what it is has left the path of wisdom.,[],[],1420557048000.0,2015-01-06 15:10:48
1646999972.0,,,,"They roll the sidewalks in this town, all up after the sun goes down.They say nothin good happens here when midnight rolls around. #SamHunt","[""SamHunt""]",[],1420557057000.0,2015-01-06 15:10:57
1646999972.0,,,,"Have faith God makes everything beautiful at the right place, at the right time. Don't worry. Don't complain. -",[],[],1420557252000.0,2015-01-06 15:14:12
1646999972.0,,,,Motherhood: All love begins and ends there.  – Robert Browning,[],[],1420557266000.0,2015-01-06 15:14:26
1646999972.0,,,,Tonight I swear I'll come home and we'll make love like we're young,[],[],1420557462000.0,2015-01-06 15:17:42
1646999972.0,,,,"Anger is our natural defense against pain. So when I say I hate you, it really means 'you hurt me'",[],[],1420557518000.0,2015-01-06 15:18:38
1646999972.0,,,,"Deep in their roots, all flowers keep the light.  – Theodore Roethke",[],[],1420722629000.0,2015-01-08 13:10:29
1646999972.0,,,,They say everything happens for a reason and people change like the seasons  – J.Cole,[],[],1420722634000.0,2015-01-08 13:10:34
1646999972.0,,,,He declares himself guilty who justifies himself before accusation.,[],[],1420722684000.0,2015-01-08 13:11:24
1646999972.0,,,,"Hey, guess what! I don't care.",[],[],1420722689000.0,2015-01-08 13:11:29
1646999972.0,,,,"School may be hard, annoying, and irritating. But admit it, you’re going to miss it when it ends.",[],[],1420722697000.0,2015-01-08 13:11:37
1646999972.0,,,,"I think I'll miss you forever, like the stars miss the sun in the morning skies.",[],[],1420722730000.0,2015-01-08 13:12:10
1646999972.0,,,,Change the way you look at things and the things you look at change.  – Wayne W. Dyer,[],[],1420722737000.0,2015-01-08 13:12:17
1646999972.0,,,,"I think I like you. Listen, when I look at you my brain goes all stupid.",[],[],1420722742000.0,2015-01-08 13:12:22
1646999972.0,,,,You will regret the things you didn't do more than the things you did.,[],[],1420722767000.0,2015-01-08 13:12:47
1646999972.0,,,,There will always that one person in your life who is an exception to all your rules no matter what they do.,[],[],1420722773000.0,2015-01-08 13:12:53
1646999972.0,,,,These Are The Dumbest Kids On Instagram,[],[],1420722796000.0,2015-01-08 13:13:16
1646999972.0,,,,"We Greeks believe that a man who takes no part in public affairs is not merely lazy, but good for nothing  – Thucydides",[],[],1420722818000.0,2015-01-08 13:13:38
1646999972.0,,,,"If everyone demanded peace instead of another television set, then there'd be peace.",[],[],1420722838000.0,2015-01-08 13:13:58
1646999972.0,,,,God always gives His best to those who leave the choice with him.  – Jim Elliot,[],[],1420722868000.0,2015-01-08 13:14:28
1646999972.0,,,,"Kindness, I've discovered, is everything in life.  – Isaac Bashevis Singer",[],[],1420722872000.0,2015-01-08 13:14:32
1646999972.0,,,,"We've all heard #11, but some of these lies men tell might surprise you!","[""11""]",[],1420722877000.0,2015-01-08 13:14:37
1646999972.0,,,,I'm still and always in love with the person you used to be.,[],[],1420722921000.0,2015-01-08 13:15:21
1646999972.0,,,,"Fight for yours and don't let go, don't let them compare you, no.",[],[],1420722943000.0,2015-01-08 13:15:43
1646999972.0,,,,"Life consists not in holding good cards, but in playing those cards you hold well.",[],[],1420722961000.0,2015-01-08 13:16:01
1646999972.0,,,,The greatest act of faith some days is to simply get up and face another day.,[],[],1420722994000.0,2015-01-08 13:16:34
1646999972.0,,,,The only person you are destined to become is the person you decide to be.,[],[],1420723006000.0,2015-01-08 13:16:46
1646999972.0,,,,Calling other people ugly doesn't make you any prettier,[],[],1420723015000.0,2015-01-08 13:16:55
1646999972.0,,,,"No matter how busy you are, you must take time to make the other person feel important.",[],[],1420723020000.0,2015-01-08 13:17:00
1646999972.0,,,,"Never give up on something you really want. It’s difficult to wait, but worse to regret.",[],[],1420723027000.0,2015-01-08 13:17:07
1646999972.0,,,,You mean more to me than you’ll ever know.,[],[],1420723048000.0,2015-01-08 13:17:28
1646999972.0,,,,The greatest pleasure in life is doing what people say you couldn't do.,[],[],1420723072000.0,2015-01-08 13:17:52
1646999972.0,,,,Discipline is just choosing between what you want now and what you want most.,[],[],1420723113000.0,2015-01-08 13:18:33
1646999972.0,,,,I don't know what you'd do for your respect but I would die for mine,[],[],1420723127000.0,2015-01-08 13:18:47
1646999972.0,,,,boyfriends that rub your back and play with your hair until you fall asleep are a gift,[],[],1420723143000.0,2015-01-08 13:19:03
1646999972.0,,,,"I can't forget the day you left, time was so unkind",[],[],1420723144000.0,2015-01-08 13:19:04
1646999972.0,,,,It's amazing how someone can turn a very bad day into the best day of your life.,[],[],1420723178000.0,2015-01-08 13:19:38
1646999972.0,,,,"With willing hearts and skillful hands, the difficult we do at once",[],[],1420723182000.0,2015-01-08 13:19:42
1646999972.0,,,,Today i went shopping and talk is still cheap  – Lil Wayne,[],[],1420723241000.0,2015-01-08 13:20:41
1646999972.0,,,,Remind yourself that you don't have to do what everyone else is doing.,[],[],1420723262000.0,2015-01-08 13:21:02
1646999972.0,,,,The only true wisdom is in knowing you know nothing,[],[],1420723277000.0,2015-01-08 13:21:17
1646999972.0,,,,I'll always catch you baby. Always...,[],[],1420723282000.0,2015-01-08 13:21:22
1646999972.0,,,,"Wise men are not always silent, but they know when to be.",[],[],1420723297000.0,2015-01-08 13:21:37
1646999972.0,,,,I do it because I can. I can because I want to. I want to because you said I couldn't.,[],[],1420723303000.0,2015-01-08 13:21:43
1646999972.0,,,,"Leadership, like coaching, is fighting for the hearts and souls of men and getting them to believe in you. -Eddie Robinson",[],[],1420723323000.0,2015-01-08 13:22:03
1646999972.0,,,,« The advantage of a bad memory is that one enjoys several times the same good things for the first time. » Nietzsc,[],[],1420723333000.0,2015-01-08 13:22:13
1646999972.0,,,,Just too cute! ❤,[],[],1420723344000.0,2015-01-08 13:22:24
1646999972.0,,,,"On a mountain he sits, not of gold but of shit",[],[],1420723412000.0,2015-01-08 13:23:32
1646999972.0,,,,Children are not casual guests in our home. They have been loaned to us temporarily for the purpose of loving them.,[],[],1420723421000.0,2015-01-08 13:23:41
1646999972.0,,,,No woman really wants a man to carry her off,[],[],1420723433000.0,2015-01-08 13:23:53
1646999972.0,,,,"Oh, won't you stay with me? 'Cause you're all I need.",[],[],1420723486000.0,2015-01-08 13:24:46
1646999972.0,,,,"Never be afraid to try something new. Remember, amateurs built the ark. Professionals built the Titanic.",[],[],1420723518000.0,2015-01-08 13:25:18
1646999972.0,,,,"Nothing is permanent in this wicked world, not even our troubles.  – Charles Chaplin",[],[],1420723560000.0,2015-01-08 13:26:00
1646999972.0,,,,A writer only begins a book. A reader finishes it.,[],[],1420723610000.0,2015-01-08 13:26:50
1646999972.0,,,,"When your heart and thoughts somehow appear to rhyme, you are in love.",[],[],1420723652000.0,2015-01-08 13:27:32
1646999972.0,,,,"Never hold your head down, never say you can't, never limit yourself, and never stop believing.",[],[],1420723684000.0,2015-01-08 13:28:04
1646999972.0,,,,"It's funny how some girls run away from the guys who try to make them happy, and fight for the ones that make them cry.",[],[],1420723701000.0,2015-01-08 13:28:21
1646999972.0,,,,"We're not as close as we used to be, but I'm here for you if you need me.",[],[],1420723709000.0,2015-01-08 13:28:29
1646999972.0,,,,"Every life has a measure of sorrow, and sometimes this is what awakens us.",[],[],1420723734000.0,2015-01-08 13:28:54
1646999972.0,,,,Every human being is intended to have a character of his own,[],[],1420723754000.0,2015-01-08 13:29:14
1646999972.0,,,,Long live rock`n`roll!!!!! http://t.co/8EhU68zr8s,[],[],1421053910000.0,2015-01-12 09:11:50
1646999972.0,,,,Great! I liked it! http://t.co/JO201FsWWq,[],[],1421053935000.0,2015-01-12 09:12:15
1646999972.0,,,,No! That`s not that moment! https://t.co/DuBNmmr54t,[],[],1421053940000.0,2015-01-12 09:12:20
1646999972.0,,,,"I believe that you can't know courage without conquering fear, and you can't really know joy without knowing sadness",[],[],1421053962000.0,2015-01-12 09:12:42
1646999972.0,,,,« The wisest have the most authority. » Plato,[],[],1421053975000.0,2015-01-12 09:12:55
1646999972.0,,,,I`m on the highway to hell!!! http://t.co/PiW1R4UOcJ,[],[],1421053986000.0,2015-01-12 09:13:06
1646999972.0,,,,"« Where fear is, happiness is not. » Seneca",[],[],1421053995000.0,2015-01-12 09:13:15
1646999972.0,,,,And so I ask God to rid me of God. The God who is known and familiar is too small for him. -Meister Eckhart,[],[],1421054000000.0,2015-01-12 09:13:20
1646999972.0,,,,YOU GUYS NEED TO LISTEN TO THIS SONG http://t.co/Dc34ThZzUN,[],[],1421054007000.0,2015-01-12 09:13:27
1646999972.0,,,,"It is not how big you are, it's how big you play. -Unknown",[],[],1421054046000.0,2015-01-12 09:14:06
1646999972.0,,,,12 Plays of #NBAXmas... D-Wade lobs it off the glass for LeBron in 2013 at #7! https://t.co/vXyIY6HffK,"[""NBAXmas""]",[],1421054050000.0,2015-01-12 09:14:10
1646999972.0,,,,Got him 😉 Ethan Dolan https://t.co/VDpxwpPj6H,[],[],1421054084000.0,2015-01-12 09:14:44
1646999972.0,,,,"Don't feel sad over someone who gave up on you, feel sorry for them because they gave up on someone who would have never given up on them.",[],[],1421054093000.0,2015-01-12 09:14:53
1646999972.0,,,,"I am a sinner, who's probably gonna sin again, Lord forgive me, things I don't understand – Kendrick Lamar",[],[],1421054097000.0,2015-01-12 09:14:57
1646999972.0,,,,NOTHING. ELSE. MATTERS. http://t.co/clsu596Pcz,[],[],1421054098000.0,2015-01-12 09:14:58
1646999972.0,,,,JOE PERRY!!!!!!! http://t.co/8EhU68zr8s,[],[],1421054177000.0,2015-01-12 09:16:17
1646999972.0,,,,"good job, man! http://t.co/vnuhEUCmmz",[],[],1421054214000.0,2015-01-12 09:16:54
1646999972.0,,,,Noone believes in resling! http://t.co/2ZtwKCdRhH,[],[],1421054227000.0,2015-01-12 09:17:07
1646999972.0,,,,Who is rocking that Hustle Gang apparel!?,[],[],1421054244000.0,2015-01-12 09:17:24
1646999972.0,,,,You can lead a horse to water. But you cannot make it drink.,[],[],1421054248000.0,2015-01-12 09:17:28
1646999972.0,,,,http://t.co/aEav9slrVu Ciara Sherzinger,[],[],1421054319000.0,2015-01-12 09:18:39
1646999972.0,,,,True and must see video! http://t.co/toHmq2OY3B,[],[],1421054333000.0,2015-01-12 09:18:53
1646999972.0,,,,That Rose to Butler alley oop https://t.co/uQQbsRDlms,[],[],1421054365000.0,2015-01-12 09:19:25
1646999972.0,,,,My favourite Aerosmith live show!!! http://t.co/8EhU68zr8s,[],[],1421054369000.0,2015-01-12 09:19:29
1646999972.0,,,,"Trying to find passion where there's no love left, it's like trying to put smoke back in this cigarette.",[],[],1421054378000.0,2015-01-12 09:19:38
1646999972.0,,,,Success is something you attract by the person you become.  – Jim Rohn,[],[],1421054397000.0,2015-01-12 09:19:57
1646999972.0,,,,"Some people make you laugh a little louder, your smile a little brighter and your life a little better.",[],[],1421054436000.0,2015-01-12 09:20:36
1646999972.0,,,,Lucky man http://t.co/x5ZRKQflXX,[],[],1421054445000.0,2015-01-12 09:20:45
1646999972.0,,,,Those who follow the crowd usually get lost in it.,[],[],1421054452000.0,2015-01-12 09:20:52
1646999972.0,,,,http://t.co/FMPkW7aNQG pitbull sucks huge donkey balls -_-,[],[],1421054467000.0,2015-01-12 09:21:07
1646999972.0,,,,Stewie Missed Breakfast! (They ended up giving me some XD) 🍳 https://t.co/gkKO42T1C8,[],[],1421054505000.0,2015-01-12 09:21:45
1646999972.0,,,,Reaction to this skill😂#soccer#skill https://t.co/jpUTL7Wzxk,"[""soccer""]",[],1421054514000.0,2015-01-12 09:21:54
1646999972.0,,,,Push yourself again and again. Don't give an inch until the final buzzer sounds. -Larry Bird,[],[],1421054532000.0,2015-01-12 09:22:12
1646999972.0,,,,"We can teach people how to be happy on the basis of secular ethics, that a compassionate mind is useful, beneficial and secular in nature.",[],[],1421054542000.0,2015-01-12 09:22:22
1646999972.0,,,,#LakersNation https://t.co/8Qcc3iSW3O,"[""LakersNation""]",[],1421054559000.0,2015-01-12 09:22:39
1646999972.0,,,,Don't marry the person you think you can live with,[],[],1421054571000.0,2015-01-12 09:22:51
1646999972.0,,,,Unexpected text messages are always nice. The fact that the person took a little bit of their time to make you smile.,[],[],1421054620000.0,2015-01-12 09:23:40
1646999972.0,,,,Tell me and I forget. Teach me and I remember. Involve me and I learn.,[],[],1421054630000.0,2015-01-12 09:23:50
1646999972.0,,,,"The truth hurts, but lies are worse.",[],[],1421054636000.0,2015-01-12 09:23:56
1646999972.0,,,,What you do speaks so loudly that I cannot hear what you say,[],[],1421054682000.0,2015-01-12 09:24:42
1646999972.0,,,,In case you change your mind I'll be waiting here.,[],[],1421054724000.0,2015-01-12 09:25:24
1646999972.0,,,,http://t.co/cimattPgBN OOOOOOOOHHHHHHHHHHHHHHHHHHHHHHHHHH,[],[],1421054744000.0,2015-01-12 09:25:44
1646999972.0,,,,"If something looks difficult, it is more fantastic to do it! Stay away from the easy things!",[],[],1421054747000.0,2015-01-12 09:25:47
1646999972.0,,,,"All voices, all goals...",[],[],1421054762000.0,2015-01-12 09:26:02
1646999972.0,,,,https://t.co/lsrhNUB57B,[],[],1421054768000.0,2015-01-12 09:26:08
1646999972.0,,,,Management is doing things right. Leadership is doing the right things. – Peter Drucker,[],[],1421054789000.0,2015-01-12 09:26:29
1646999972.0,,,,Death is always...,[],[],1421054822000.0,2015-01-12 09:27:02
1646999972.0,,,,"You may never know what results come of your actions, but if you do nothing, there will be no results.",[],[],1421054825000.0,2015-01-12 09:27:05
1646999972.0,,,,"If you do what you've always done, you'll get what you've always gotten.",[],[],1421054879000.0,2015-01-12 09:27:59
1646999972.0,,,,"When things aren't adding up in your life, start subtracting.",[],[],1421054886000.0,2015-01-12 09:28:06
1646999972.0,,,,Be slow to fall into friendship,[],[],1421054888000.0,2015-01-12 09:28:08
1646999972.0,,,,I like to feel prejudice towards people who are prejudice,[],[],1421054913000.0,2015-01-12 09:28:33
1646999972.0,,,,The scariest part of this commercial is whatever that green shit is http://t.co/qysIQSXBab,[],[],1421054968000.0,2015-01-12 09:29:28
1646999972.0,,,,"How wrong is it for a woman to expect the man to build the world she wants, rather than to create it herself?",[],[],1421054974000.0,2015-01-12 09:29:34
1646999972.0,,,,Google is getting good lmao,[],[],1421054985000.0,2015-01-12 09:29:45
1646999972.0,,,,"If it is worth doing, it is worth overdoing.",[],[],1421054991000.0,2015-01-12 09:29:51
1646999972.0,,,,Life in the world is your opportunity to understand and know who you ultimately are. This is enlightenment.,[],[],1421055059000.0,2015-01-12 09:30:59
1646999972.0,,,,We come from a generation where your relationship could possibly be ruined by your snapchat best friends,[],[],1421055060000.0,2015-01-12 09:31:00
1646999972.0,,,,"Kindness, I've discovered, is everything in life.  – Isaac Bashevis Singer",[],[],1421055072000.0,2015-01-12 09:31:12
1646999972.0,,,,We do not inherit the earth from our fathers. We borrow it from our children. #quote #Peace #IAMONFIRE,"[""quote""]",[],1421431769000.0,2015-01-16 18:09:29
1646999972.0,,,,"Don't let the past hold you back, otherwise you'll miss all the good stuff happening now. #iamonfire","[""Iamonfire""]",[],1421432037000.0,2015-01-16 18:13:57
1646999972.0,,,,#IAMONFIRE The only workout you'll ever regret is the one you didn't do.,"[""Iamonfire""]",[],1421432100000.0,2015-01-16 18:15:00
1646999972.0,,,,"The important thing is not winning, it's making everyone else lose. -stacy aguilar #IAMONFIRE","[""Iamonfire""]",[],1421432121000.0,2015-01-16 18:15:21
1646999972.0,,,,#IAMONFIRE I'd rather learn from one bird how to sing than teach ten thousand stars how not to dance. - E.E. Cummings,"[""Iamonfire""]",[],1421432140000.0,2015-01-16 18:15:40
1646999972.0,,,,#IAMONFIRE What a slut she is! http://t.co/C1JQuIpcbW,"[""Iamonfire""]",[],1421432171000.0,2015-01-16 18:16:11
1646999972.0,,,,"#iamonfire “If you're not failing every now and again, it's a sign you're not doing anything very innovative.” ― Woody Allen","[""Iamonfire""]",[],1421432386000.0,2015-01-16 18:19:46
1646999972.0,,,,"Nothing is permanent in this wicked world, not even our troubles. - Charles Chaplin #IAMONFIRE","[""Iamonfire""]",[],1421432416000.0,2015-01-16 18:20:16
1646999972.0,,,,#IAMONFIRE http://t.co/RQvr9xEa56 thanks God it wasn`t me!,"[""Iamonfire""]",[],1421432471000.0,2015-01-16 18:21:11
1646999972.0,,,,#IAMONFIRE Strength doesn't come from winning. Your struggles build your strength.,"[""Iamonfire""]",[],1421432596000.0,2015-01-16 18:23:16
1646999972.0,,,,"#iamonfire ""Go confidently in the direction of your dreams. Live the life you have imagined."" - Henry David Thoreau","[""Iamonfire""]",[],1421432644000.0,2015-01-16 18:24:04
1646999972.0,,,,#IAmOnFire http://t.co/GQakR5kzLo want to do my own!,"[""Iamonfire""]",[],1421432663000.0,2015-01-16 18:24:23
1646999972.0,,,,"#IAmOnFire We can't change the cards we are dealt, just how we play the hand.","[""Iamonfire""]",[],1421432790000.0,2015-01-16 18:26:30
1646999972.0,,,,#IAmOnFire Wtf is going on here?? https://t.co/tmbRkJRdnx,"[""Iamonfire""]",[],1421432822000.0,2015-01-16 18:27:02
1646999972.0,,,,#IAMONFIRE O Lord give me friends that understand me and my feelings. #PrayerOfLife,"[""Iamonfire""]",[],1421432848000.0,2015-01-16 18:27:28
1646999972.0,,,,#IAmOnFire Your age doesn't define your maturity. Your grades don’t define your intellect. rumors don’t define who you are.,"[""Iamonfire""]",[],1421432991000.0,2015-01-16 18:29:51
1646999972.0,,,,#IAMONFIRE Stewie Missed Breakfast! (They ended up giving me some XD) 🍳 https://t.co/5cOfY1js3S,"[""Iamonfire""]",[],1421433022000.0,2015-01-16 18:30:22
1646999972.0,,,,"This is a court of law young man, not a court of justice. -Oliver Wendell Holmes #law_and_lawyers #iamonfire","[""law_and_lawyers""]",[],1421433065000.0,2015-01-16 18:31:05
1646999972.0,,,,• Train harder. • Run faster. • Dream harder. • Aim higher. BE THE BEST YOU CAN BE. #IAmOnFire,"[""Iamonfire""]",[],1421433178000.0,2015-01-16 18:32:58
1646999972.0,,,,Most folks are about as happy as they make up their minds to be - Abraham Lincoln #quotes #IAMONFIRE,"[""Quotes""]",[],1421433373000.0,2015-01-16 18:36:13
1646999972.0,,,,The difference between who you ARE and who you WANT TO BE is the work you put in. #IAMONFIRE,"[""Iamonfire""]",[],1421433488000.0,2015-01-16 18:38:08
1646999972.0,,,,"#IAmOnFire It's the lack of faith that makes people afraid of meeting challenges, and I believe in myself. -Muhammad Ali","[""Iamonfire""]",[],1421433592000.0,2015-01-16 18:39:52
1646999972.0,,,,You'll never get ahead of anyone as long as you try to get even with him. -Lou Holtz #IAMONFIRE,"[""Iamonfire""]",[],1421433615000.0,2015-01-16 18:40:15
1646999972.0,,,,My choice,[],[],1421433649000.0,2015-01-16 18:40:49
1646999972.0,,,,A penny saved is worthless - Dave Barry #quotes #IAmOnFire,"[""Quotes""]",[],1421433926000.0,2015-01-16 18:45:26
1646999972.0,,,,#IAMONFIRE Treat her like a queen and she'll treat you like a king. Treat her like a game and she'll show you how it's played....,"[""Iamonfire""]",[],1421433937000.0,2015-01-16 18:45:37
1646999972.0,,,,Goals are dreams with deadlines - Diana Scharf Hunt #quotes #IAMONFIRE,"[""Quotes""]",[],1421433956000.0,2015-01-16 18:45:56
1646999972.0,,,,"#IAmOnFire Don't go through life, grow through life - Eric Butterworth #quotes","[""Iamonfire""]",[],1421433987000.0,2015-01-16 18:46:27
1646999972.0,,,,#IAMONFIRE he is really cool! https://t.co/LQ3wVEkEdo,"[""Iamonfire""]",[],1421434004000.0,2015-01-16 18:46:44
1646999972.0,,,,"#IAMONFIRE T. Coraghessan Boyle: We are like Kafka's Hunger Artist, performing astonishing feats for a nonexistent audience.","[""Iamonfire""]",[],1421434024000.0,2015-01-16 18:47:04
1646999972.0,,,,#IAmOnFire New tattoo spelling fails that have me shaking my head . . . and LOLing!,"[""Iamonfire""]",[],1421434115000.0,2015-01-16 18:48:35
1646999972.0,,,,#iamonfire Tag a friend that throws this bad😂 https://t.co/cf99S0ErCc,"[""Iamonfire""]",[],1421434134000.0,2015-01-16 18:48:54
1646999972.0,,,,music helps me escape reality. #iamonfire,"[""Iamonfire""]",[],1421434191000.0,2015-01-16 18:49:51
1646999972.0,,,,"""The absence of alternatives clears the mind marvellously."" - Henry Kissinger #quotes #IAmOnFire","[""Quotes""]",[],1421434375000.0,2015-01-16 18:52:55
1646999972.0,,,,"#IAMONFIRE ""It takes courage to grow up and become who you really are."" - E.E. Cummings","[""Iamonfire""]",[],1421434411000.0,2015-01-16 18:53:31
1646999972.0,,,,"“To learn something, to master something, anything, is as sweet as first love.” ― Geoffrey Wolff #IAmOnFire","[""Iamonfire""]",[],1421434459000.0,2015-01-16 18:54:19
1646999972.0,,,,#iamonfire Only I can change my life. No one can do it for me - Carol Burnett #quotes,"[""Iamonfire""]",[],1421434485000.0,2015-01-16 18:54:45
1646999972.0,,,,Never tell me the odds. -Star Wars - Han Solo Movie #risk #iamonfire,"[""risk""]",[],1421434613000.0,2015-01-16 18:56:53
1646999972.0,,,,You can never be overdressed or overeducated. - Oscar Wilde #IAmOnFire,"[""Iamonfire""]",[],1421434752000.0,2015-01-16 18:59:12
1646999972.0,,,,#SomeoneWhoKillsChildren What kind of president would be lecturing students while is country is about to break down?,"[""SomeoneWhoKillsChildren""]",[],1421774798000.0,2015-01-20 17:26:38
1646999972.0,,,,Innocent kids! #SomeoneWhoKillsChildren,"[""SomeoneWhoKillsChildren""]",[],1421774996000.0,2015-01-20 17:29:56
1646999972.0,,,,Poroshenko in Zurich met with protest #SomeoneWhoKillsChildren,"[""SomeoneWhoKillsChildren""]",[],1421775399000.0,2015-01-20 17:36:39
1646999972.0,,,,"Students at the University of Zurich were holding banners with slogans: ""Donbass may self-determination"" #SomeoneWhoKillsChildren","[""SomeoneWhoKillsChildren""]",[],1421775677000.0,2015-01-20 17:41:17
1646999972.0,,,,"Children in eastern Ukraine are largely confined to the basement, with limited access to fresh air and daylight. #SomeoneWhoKillsChildren","[""SomeoneWhoKillsChildren""]",[],1421775765000.0,2015-01-20 17:42:45
1646999972.0,,,,#SomeoneWhoKillsChildren and the elderly and women and innocent. Shall I go on?,"[""SomeoneWhoKillsChildren""]",[],1421775858000.0,2015-01-20 17:44:18
1646999972.0,,,,Leader of the country leaves his troops in the middle of the operation.Nice idea! #SomeoneWhoKillsChildren,"[""SomeoneWhoKillsChildren""]",[],1421775876000.0,2015-01-20 17:44:36
1646999972.0,,,,#NationalFreedomDay IRS is being used as a political weapon against GOP party #FlyYourFlags,"[""NationalFreedomDay""]",[],1422812105000.0,2015-02-01 17:35:05
