user_id,retweet_count,retweeted,favorite_count,text,hashtags,mentions,created_at,created_str
3071479646.0,0.0,False,0.0,"#Breaking: Trump supporters, protesters confront each other in Baltimore https://t.co/TmZ0AwewsV","[""breaking""]",[],1473712725000.0,2016-09-12 20:38:45
3071479646.0,0.0,False,0.0,"Trump supporters, protesters confront each other in Baltimore https://t.co/TmZ0AwewsV #breaking","[""breaking""]",[],1473712725000.0,2016-09-12 20:38:45
3071479646.0,0.0,False,0.0,"UPDATE: Clinton Diagnosed with Pneumonia, ‘Recovering Nicely’ A... https://t.co/zvxzzSijR6 | https://t.co/cdnQqWB38H",[],[],1473715995000.0,2016-09-12 21:33:15
3071479646.0,0.0,False,0.0,Trump says Clinton's 'deplorables' remark is disqualifying https://t.co/dgxbvAMhaz,[],[],1473720222000.0,2016-09-12 22:43:42
3071479646.0,0.0,False,0.0,Trump greeted warmly at Dundalk diner https://t.co/QDpvx8931D #breaking,"[""breaking""]",[],1473720724000.0,2016-09-12 22:52:04
3071479646.0,0.0,False,0.0,#Breaking: Trump greeted warmly at Dundalk diner https://t.co/QDpvx8931D,"[""breaking""]",[],1473720724000.0,2016-09-12 22:52:04
3071479646.0,0.0,False,0.0,Trump greeted warmly at Dundalk diner https://t.co/K4bQr9lZAv,[],[],1473723122000.0,2016-09-12 23:32:02
3071479646.0,1.0,False,0.0,Baltimore to pay for more election judge training after troubled primary https://t.co/pfQc9dESul,[],[],1473862999000.0,2016-09-14 14:23:19
3071479646.0,0.0,False,0.0,#Breaking: Baltimore to pay for more election judge training after troubled primary https://t.co/kiIHDx3zkk,"[""breaking""]",[],1473863261000.0,2016-09-14 14:27:41
3071479646.0,0.0,False,0.0,Baltimore to pay for more election judge training after troubled primary https://t.co/kiIHDx3zkk #breaking,"[""breaking""]",[],1473863265000.0,2016-09-14 14:27:45
3071479646.0,0.0,False,0.0,Artists Will Not Stop Tormenting America With Nude Trump Statues https://t.co/IUq8f9Bs4u | https://t.co/cdnQqWB38H https://t.co/Rn0nhPk171,[],[],1473887607000.0,2016-09-14 21:13:27
3071479646.0,0.0,False,0.0,I Hate Malia Obama’s Friends https://t.co/T9V1Sbbxu0 | https://t.co/cdnQqWB38H,[],[],1473887727000.0,2016-09-14 21:15:27
3071479646.0,1.0,False,0.0,Baltimore City seeks to avoid election problems https://t.co/3nUxbpScUh,[],[],1473891151000.0,2016-09-14 22:12:31
3071479646.0,0.0,False,0.0,Alan Cumming: Trump Allows People To Espouse Views They'd Oth... https://t.co/vydM1vKzdT | https://t.co/cdnQqWB38H https://t.co/OwW54Z8xWg,[],[],1474017199000.0,2016-09-16 09:13:19
3071479646.0,0.0,False,0.0,Why Are Black Ministers Inviting Trump to Their Churches? https://t.co/mLS6i1JcDt | https://t.co/cdnQqWB38H https://t.co/fUoWV6rIIR,[],[],1474146808000.0,2016-09-17 21:13:28
3071479646.0,0.0,False,0.0,It Looks Like Donald Trump Is Done Talking About Birther Stuff https://t.co/ubNc5ufleN | https://t.co/cdnQqWB38H https://t.co/7NeMJviRXI,[],[],1474168410000.0,2016-09-18 03:13:30
3071479646.0,0.0,False,0.0,"Students Share Why They'll Miss Michelle Obama, 'America's Se... https://t.co/RuAUERfLqq | https://t.co/cdnQqWB38H https://t.co/Stsy2wmXrO",[],[],1474189998000.0,2016-09-18 09:13:18
3071479646.0,0.0,False,0.0,Obama: Low Turnout By Black Voters Would Be 'A Personal Insult' https://t.co/yXOS87fXNq | https://t.co/cdnQqWB38H https://t.co/zd9tKSZcDK,[],[],1474211603000.0,2016-09-18 15:13:23
3071479646.0,0.0,False,0.0,Trump Super PAC Strategist Says There Is An 'Otherness' To Obama https://t.co/Rk2bG85OUQ | https://t.co/cdnQqWB38H https://t.co/RBB745SaFa,[],[],1474233206000.0,2016-09-18 21:13:26
3071479646.0,0.0,False,0.0,What Trump And Clinton Must Do To Win The Debates https://t.co/zBqjtaWNGW | https://t.co/cdnQqWSExh https://t.co/NbVtRV570U,[],[],1474341211000.0,2016-09-20 03:13:31
3071479646.0,0.0,False,0.0,#Breaking: Kathleen Kennedy Townsend says George H.W. Bush will vote for Hillary Clinton https://t.co/Hx6KtBt25o,"[""breaking""]",[],1474384046000.0,2016-09-20 15:07:26
3071479646.0,0.0,False,0.0,Only Lin-Manuel Miranda Could Turn Trump's Tweets Into Someth... https://t.co/EAiE3JSFnW | https://t.co/cdnQqWB38H https://t.co/HVxkqmPGtF,[],[],1474406010000.0,2016-09-20 21:13:30
3071479646.0,0.0,False,0.0,Movie About President Obama’s College Years Heading to Netflix https://t.co/BzNYWDME2V | https://t.co/cdnQqWB38H,[],[],1474427714000.0,2016-09-21 03:15:14
3071479646.0,0.0,False,0.0,Trump calls for expanded use of stop and frisk https://t.co/1TX7Mfy80e,[],[],1474509145000.0,2016-09-22 01:52:25
3071479646.0,0.0,False,0.0,"Congressman issues statement on Trump, use of stop-and-frisk https://t.co/ykjuQqlSD1",[],[],1474510203000.0,2016-09-22 02:10:03
3071479646.0,0.0,False,0.0,"Poll finds Clinton, Van Hollen with wide leads in Maryland https://t.co/eMWNVjEeZp",[],[],1474562934000.0,2016-09-22 16:48:54
3071479646.0,1.0,False,0.0,Mike Pence Says We Shouldn't Talk About Racial Bias In The Wake Of Police Shootings https://t.co/4grQHAnDiZ https://t.co/XR0EIF94qD,[],[],1474621878000.0,2016-09-23 09:11:18
3071479646.0,0.0,False,0.0,Russell Simmons: Donald Trump Is The Epitome Of White Supremacy https://t.co/gbpQzOo1Z9 https://t.co/49KW8MluZl,[],[],1474686690000.0,2016-09-24 03:11:30
3071479646.0,0.0,False,0.0,Bill Maher Slams Donald Trump For Blaming Charlotte Protests On Drugs https://t.co/rkrl38763P https://t.co/tUCZsHnFRG,[],[],1474794676000.0,2016-09-25 09:11:16
3071479646.0,0.0,False,0.0,"Hillary Clinton Postpones Visit to Charlotte, NC, Citing Security Concerns https://t.co/ZaTjKSsTSR",[],[],1474795993000.0,2016-09-25 09:33:13
3071479646.0,0.0,False,0.0,Barack Obama Advises His 2009 Self In Hilarious Jimmy Fallon Clip https://t.co/LMaCQ7bm01 https://t.co/X1kvp6faPR,[],[],1474816281000.0,2016-09-25 15:11:21
3071479646.0,2.0,False,1.0,Civil Rights Museum Rejects Donald Trump's VIP Visit Request https://t.co/X40NsHnl6f https://t.co/tcsyA99I7a,[],[],1474927042000.0,2016-09-26 21:57:22
3071479646.0,1.0,False,0.0,Clinton-Trump debate: A bad TV night for the reality TV star who would be president https://t.co/9aZGQ66iGt,[],[],1474955295000.0,2016-09-27 05:48:15
3071479646.0,0.0,False,0.0,All The Dumb Things Trump Said About Race At The First Debate https://t.co/h9NLipn3zM https://t.co/VSbPENll2N,[],[],1474968024000.0,2016-09-27 09:20:24
3071479646.0,0.0,False,0.0,Man displays presidential election memorabilia collection https://t.co/Tm8LiCNxGF,[],[],1475000693000.0,2016-09-27 18:24:53
3071479646.0,0.0,False,0.0,Trump's Donald-come-lately pledges to African-Americans https://t.co/VRQUVmanj0,[],[],1475016757000.0,2016-09-27 22:52:37
3071479646.0,1.0,False,1.0,#Breaking: Candidates for Baltimore mayor debate in first general election forum https://t.co/aCHjewCq2c,"[""breaking""]",[],1475031658000.0,2016-09-28 03:00:58
3071479646.0,0.0,False,0.0,Candidates for Baltimore mayor debate in first general election forum https://t.co/EnNN6NdLnT,[],[],1475032025000.0,2016-09-28 03:07:05
3071479646.0,0.0,False,0.0,The Internet Has Questions About Mary J. Blige Singing to Hillary Clinton https://t.co/GVl2wqHmAP,[],[],1475096711000.0,2016-09-28 21:05:11
3071479646.0,0.0,False,0.0,"Obama Hopes Military Members, National Anthem Protesters Will Consider Each Others' Pain https://t.co/zra9ZPFRa4 https://t.co/Sz3LeDkrzW",[],[],1475119824000.0,2016-09-29 03:30:24
3071479646.0,0.0,False,0.0,Arizona Republic Back Hillary Clinton For President https://t.co/IUZlDCuerP,[],[],1475120122000.0,2016-09-29 03:35:22
3071479646.0,0.0,False,0.0,Congress Hands President Obama His 1st Veto Override https://t.co/zCtyoE1ndf,[],[],1475183663000.0,2016-09-29 21:14:23
3071479646.0,0.0,False,0.0,Pennsylvania Mayor Posts Racist Meme About Lynching President Obama https://t.co/Qh7KwxSJRQ https://t.co/quMfFluJqY,[],[],1475229331000.0,2016-09-30 09:55:31
3071479646.0,0.0,False,0.0,Congress Adjourns for the Election but Still Has Lots of Work to Do https://t.co/ke9svR13wd,[],[],1475313253000.0,2016-10-01 09:14:13
3071479646.0,0.0,False,0.0,Election 2016: What Black Women Want https://t.co/mK2UBx3lji https://t.co/mwcrqAhTzC,[],[],1475357364000.0,2016-10-01 21:29:24
3071479646.0,0.0,False,0.0,Mary J. Blige Didn’t Ask Clinton About Hateration; Nor Did She Just Break Out Singing. ... https://t.co/VHb9sTwYXS,[],[],1475399773000.0,2016-10-02 09:16:13
3071479646.0,0.0,False,0.0,Alec Baldwin Slays With Hilarious Donald Trump Impression On 'SNL' https://t.co/3aYSrROTl5 https://t.co/mAghZ9EnzO,[],[],1475400553000.0,2016-10-02 09:29:13
3071479646.0,0.0,False,0.0,#Breaking: New crop of GOP candidates running for U.S. House seats https://t.co/xHGuxKOZ5I,"[""breaking""]",[],1475454311000.0,2016-10-03 00:25:11
3071479646.0,,,,Police make arrest in fatal Annapolis shooting https://t.co/K541CVhRjr,[],[],1475462697000.0,2016-10-03 02:44:57
3071479646.0,,,,"#Breaking: Baltimore colleges receive $750,000 to combat sexual assaults https://t.co/VGNaWwQapU","[""breaking""]",[],1475743956000.0,2016-10-06 08:52:36
3071479646.0,,,,Ameriprise Financial opens office in Legg Mason Tower https://t.co/tKj33fNr7p,[],[],1475766908000.0,2016-10-06 15:15:08
3071479646.0,,,,Md. delegation wants Howard Co. sheriff to resign https://t.co/LMWQ1USmqk,[],[],1475773691000.0,2016-10-06 17:08:11
3071479646.0,,,,Official talks of Md. prison system downsizing https://t.co/e2ygzlpw0W,[],[],1475786698000.0,2016-10-06 20:44:58
3071479646.0,,,,Dissenting medical marijuana commissioner replaced https://t.co/a9YbGxDIhF #politics,"[""Politics""]",[],1475792498000.0,2016-10-06 22:21:38
3071479646.0,,,,Man shot on Laurens Street in Baltimore https://t.co/aqNG6KRZQ2,[],[],1475817301000.0,2016-10-07 05:15:01
3071479646.0,,,,"Open Studio Tour showcases new artists, new spaces https://t.co/dvIsKNW0es",[],[],1475966415000.0,2016-10-08 22:40:15
3071479646.0,,,,Howard County Sheriff James Fitzgerald resigns https://t.co/8bldyxbfwF,[],[],1476271629000.0,2016-10-12 11:27:09
3071479646.0,1.0,False,0.0,Judge dismisses lawsuit that asked for do-over of Baltimore primary election https://t.co/AWViyp1XJ0 #politics,"[""Politics""]",[],1476747988000.0,2016-10-17 23:46:28
3071479646.0,3.0,False,1.0,"After errors in primary election, civic groups recruiting citizen poll watchers https://t.co/M6bVLbIJVc",[],[],1476822174000.0,2016-10-18 20:22:54
3071479646.0,0.0,False,1.0,State GOP hopes to 'shock the world' in presidential race https://t.co/OucWlX7foj,[],[],1476883544000.0,2016-10-19 13:25:44
3071479646.0,0.0,False,0.0,"Baltimore struggles to recruit, train additional election judges https://t.co/KOZg9B8FGl",[],[],1476922348000.0,2016-10-20 00:12:28
3071479646.0,0.0,False,0.0,Baltimore City pledges to be ready for Election Day https://t.co/KND0QYYbiK,[],[],1476970062000.0,2016-10-20 13:27:42
3071479646.0,,,,Early voting begins tomorrow in Maryland https://t.co/SZC0jdUIys #politics,"[""Politics""]",[],1477499985000.0,2016-10-26 16:39:45
3071479646.0,1.0,False,0.0,"Independent, Green candidates raise more money, challenge Democrat in Baltimore's 12th District https://t.co/jHna6vBAFb #politics","[""Politics""]",[],1477678940000.0,2016-10-28 18:22:20
3071479646.0,,,,Lawsuit: Maryland medical marijuana panel illegally ignored race of applicants https://t.co/ncbEY6ehmW #politics,"[""Politics""]",[],1477929917000.0,2016-10-31 16:05:17
3071479646.0,0.0,False,0.0,"Gansler, Sachs call FBI decision on Clinton emails 'serious mistake' https://t.co/wvY4SjtNWn #politics","[""Politics""]",[],1477943752000.0,2016-10-31 19:55:52
3071479646.0,,,,Longtime president of Stevenson University moves up his retirement for health issues https://t.co/jhKH1dRKMY https://t…,[],[],1480448897000.0,2016-11-29 19:48:17
3071479646.0,,,,"Five Harford heroin deaths in five days, but worst is yet to come, police and health o... https://t.co/LQXKfgLeI9 http…",[],[],1480456302000.0,2016-11-29 21:51:42
3071479646.0,,,,This Christmas tree pays tribute to Iowa police officers killed this year in the line ... https://t.co/RVTxWloTVR http…,[],[],1480860492000.0,2016-12-04 14:08:12
3071479646.0,,,,Police Seek Suspect In Fatal Daytime Stabbing In Glen Burnie https://t.co/Xb0U1xHnIi https://t.co/zmHXtti0Na,[],[],1481037086000.0,2016-12-06 15:11:26
3071479646.0,,,,Goucher College only Maryland institution to grant bachelor's degrees behind bars https://t.co/YfXKZHnkDM https://t.co…,[],[],1481199619000.0,2016-12-08 12:20:19
3071479646.0,,,,Suspect dead in West Virginia police shooting https://t.co/YCd6L7ehmP https://t.co/nsD0A9nBXr,[],[],1481539706000.0,2016-12-12 10:48:26
3071479646.0,,,,Reno boy shot by school police remains in coma after stroke https://t.co/1r0GYxRiPZ https://t.co/6QmEzigeTy,[],[],1481656694000.0,2016-12-13 19:18:14
3071479646.0,,,,"Below the surface, a vexing problem for Towson Row https://t.co/BfbnyCWsMA https://t.co/RvtC99h9as",[],[],1481759198000.0,2016-12-14 23:46:38
3071479646.0,,,,Wind Advisory In Effect https://t.co/RGfMm8dfhi https://t.co/G29CBo8dsT,[],[],1481795899000.0,2016-12-15 09:58:19
3071479646.0,,,,"With wind chills in the single digits, Baltimore braces for an early arctic blast https://t.co/itiMp6ZOq1 https://t.co…",[],[],1481854469000.0,2016-12-16 02:14:29
3071479646.0,,,,WATCH: Kamar Aiken Gets Ravens On The Board First https://t.co/Mzs1QKznby https://t.co/Lab49TQiqK,[],[],1482087613000.0,2016-12-18 19:00:13
3071479646.0,,,,The Latest: Saturday’s Major Crashes on I-95 https://t.co/6oAQlUj8KK https://t.co/k0nElyiMUH,[],[],1482285150000.0,2016-12-21 01:52:30
3071479646.0,,,,Police: Officer's 2-year-old son shot himself with dad's gun https://t.co/5xQrLRWyht https://t.co/qODRPw3h0a,[],[],1482518899000.0,2016-12-23 18:48:19
3071479646.0,,,,Police: Man Walking Dog Killed by Hit-Run Driver https://t.co/2vBAikvGj0 https://t.co/GJa0XRjCWR,[],[],1482679587000.0,2016-12-25 15:26:27
3071479646.0,,,,Pennsylvania man killed in crash along I-95 in Baltimore County https://t.co/tSHehEpWYD https://t.co/GMXOm0lkGa,[],[],1482775237000.0,2016-12-26 18:00:37
3071479646.0,,,,Dead Fish Washing On Shore Puzzles County Residents https://t.co/MYeEOfAW4W https://t.co/fGKuu4AZnG,[],[],1482877762000.0,2016-12-27 22:29:22
3071479646.0,,,,Historians boycotting North Carolina over bathroom bill move conference to Baltimore https://t.co/86NYWsORpP https://t…,[],[],1482885077000.0,2016-12-28 00:31:17
3071479646.0,,,,Four People Taken To Hospital After Collision On Bay Bridge https://t.co/xcxPtZQGEq https://t.co/pxzh5c9Ost,[],[],1483154736000.0,2016-12-31 03:25:36
3071479646.0,,,,"On Time: January 1, 2017 https://t.co/8NuyaAIWB2 https://t.co/2khkSNCxOm",[],[],1483278998000.0,2017-01-01 13:56:38
3071479646.0,,,,Drones could soon get crucial medical supplies to patients in need https://t.co/S4tKxsDJza https://t.co/gJrft9W2pR,[],[],1483286418000.0,2017-01-01 16:00:18
3071479646.0,,,,State reaches settlement in ex-deputy's suit against Baltimore sheriff https://t.co/kIdTqv9KrH https://t.co/7EJamZAEjG,[],[],1483396220000.0,2017-01-02 22:30:20
3071479646.0,,,,"Baltimore, D.C. Rank #1 and #2 On Orkin’s ‘Bed Bugs Cities’ List https://t.co/39vVf9ZvdY https://t.co/vFr3k4X0gp","[""1""]",[],1483469355000.0,2017-01-03 18:49:15
3071479646.0,,,,Police Trying To Locate Van Involved In Hit-And-Run That Injured 69-Year-Old https://t.co/vruymeKm18 https://t.co/dqH1…,[],[],1483476621000.0,2017-01-03 20:50:21
3071479646.0,,,,Orioles sign former top prospect Jesus Montero https://t.co/vBeLAwuLH8 https://t.co/6G8IRw24ob,[],[],1483491100000.0,2017-01-04 00:51:40
3071479646.0,,,,Sugar Free Kids Md. Proposes Bill For Healthier Vending Machines https://t.co/rKMHYCuBQs https://t.co/xAoxfsfsNq,[],[],1483636702000.0,2017-01-05 17:18:22
3071479646.0,,,,1 Found Dead in Overturned Car on Icy Pond in Maryland https://t.co/tgR6x1ePzv https://t.co/e2vCFXYrUB,[],[],1483804921000.0,2017-01-07 16:02:01
3071479646.0,,,,Alleged airport gunman had several run-ins with police https://t.co/FeHMRYSKvO https://t.co/ZO2V04bz2W,[],[],1483841270000.0,2017-01-08 02:07:50
3071479646.0,,,,Mindgrub lands deal to develop mobile apps for Exelon utilities https://t.co/REFEdJbWZW https://t.co/vRfH3YCE71,[],[],1484239484000.0,2017-01-12 16:44:44
3071479646.0,,,,Three Alarm Fire In Mt. Vernon https://t.co/oBtdSFO8cl https://t.co/zX3bIALQa8,[],[],1484443757000.0,2017-01-15 01:29:17
3071479646.0,,,,Istanbul Nightclub Shooting Suspect Arrested https://t.co/AcsT1QZQ39 https://t.co/VYYswJaPxi,[],[],1484647546000.0,2017-01-17 10:05:46
3071479646.0,,,,Pedestrian Struck On Capital Beltway In Silver Spring https://t.co/Il2jNC5Rzn https://t.co/ALpZwKHSJk,[],[],1484742495000.0,2017-01-18 12:28:15
3071479646.0,,,,Weather Blog: Calm And Mild Start To The Day https://t.co/Oj9CV3ktWE https://t.co/Ce62C7XOXH,[],[],1484830391000.0,2017-01-19 12:53:11
3071479646.0,,,,Mexican Drug Kingpin “El Chapo” To Appear In US Courtroom https://t.co/jMUpA5xamA https://t.co/CnjZaWpwqX,[],[],1484910603000.0,2017-01-20 11:10:03
3071479646.0,,,,"NC Man Found With 1,200 Cartons of Untaxed Cigarettes https://t.co/2H1Hit0pTR https://t.co/JoooFd4w0I",[],[],1485450052000.0,2017-01-26 17:00:52
3071479646.0,,,,Baltimore police see spike in juvenile crime https://t.co/hy1KVCmiIj https://t.co/V2mNseexUv,[],[],1485523528000.0,2017-01-27 13:25:28
