user_id,retweet_count,retweeted,favorite_count,text,hashtags,mentions,created_at,created_str
1039581360.0,0.0,False,0.0,Foke Hillary Clinton's nurse appears to check pulse before her collapse at 9/11 memorial https://t.co/2ekx4NCAzJ #Foke,"[""Foke""]",[],1473800733000.0,2016-09-13 21:05:33
1039581360.0,0.0,False,0.0,Foke Hillary Clinton 'HATES' President Obama for defeating her in the 2008 election https://t.co/V3lI3xRDlR #Foke,"[""Foke""]",[],1473860675000.0,2016-09-14 13:44:35
1039581360.0,0.0,False,0.0,"Foke Hillary Clinton 'kept blood clot SECRET from her staff', says doctor https://t.co/o3JYvihZt5 #Foke","[""Foke""]",[],1473868658000.0,2016-09-14 15:57:38
1039581360.0,0.0,False,0.0,Foke Hillary Clinton has bacterial pneumonia campaign says https://t.co/EBzaQeIwkC #Foke,"[""Foke""]",[],1473892924000.0,2016-09-14 22:42:04
1039581360.0,0.0,False,0.0,Foke Donald Trump is back to questioning ailing Hillary' Clinton's stamina https://t.co/MqETPjyyPd #Foke,"[""Foke""]",[],1473912895000.0,2016-09-15 04:14:55
1039581360.0,0.0,False,0.0,Foke Hillary Clinton's health bombshell explained https://t.co/2uZWXonvTv #Foke,"[""Foke""]",[],1473920951000.0,2016-09-15 06:29:11
1039581360.0,0.0,False,0.0,Foke I'll release MORE of my medical records says Clinton after bombshell revelation of her secret surgery  https://t.co/HxGBLJx12Y #Foke,"[""Foke""]",[],1473945430000.0,2016-09-15 13:17:10
1039581360.0,0.0,False,0.0,Foke How brazen Bill Clinton and Monica Lewinsky were never far apart UNTIL their steamy phone sex was ... https://t.co/9uxdsGwaxr #Foke,"[""Foke""]",[],1473949568000.0,2016-09-15 14:26:08
1039581360.0,0.0,False,0.0,Foke Hillary Clinton back on trail after pneumonia truth was revealed https://t.co/yFvSbtJlxK #Foke,"[""Foke""]",[],1473978652000.0,2016-09-15 22:30:52
1039581360.0,0.0,False,0.0,Foke Trump campaign FINALLY admits that Obama is an American - but says Clinton was the one who raised ... https://t.co/VvVZivT0ux #Foke,"[""Foke""]",[],1473998075000.0,2016-09-16 03:54:35
1039581360.0,0.0,False,0.0,Foke Bill Clinton’s ‘transparent’ Global Initiative BANS reporters from key speeches https://t.co/MiXLR7UpY2 #Foke,"[""Foke""]",[],1474413718000.0,2016-09-20 23:21:58
1039581360.0,0.0,False,0.0,Foke Hillary Clinton says she doesn't need to take brain function tests https://t.co/nge7aRdYvi #Foke,"[""Foke""]",[],1474605314000.0,2016-09-23 04:35:14
1039581360.0,0.0,False,0.0,Foke Obama delivers rousing speech at opening of Smithsonian National African American museum https://t.co/ssYzV1qtVH #Foke,"[""Foke""]",[],1474739957000.0,2016-09-24 17:59:17
1039581360.0,0.0,False,0.0,"Foke The world's fixated on Trump. But Hillary could drag us ALL into a catastrophic war, writes PETER ... https://t.co/n87tc6QXmz #Foke","[""Foke""]",[],1474774768000.0,2016-09-25 03:39:28
1039581360.0,0.0,False,0.0,Foke Photo of Michelle Obama and George W. Bush hugging edited https://t.co/gjFs8kXb3z #Foke,"[""Foke""]",[],1474816156000.0,2016-09-25 15:09:16
1039581360.0,0.0,False,0.0,Foke Israeli statesman Shimon Peres's funeral to be attended by Obama and the Clintons https://t.co/UiWt7QCr7k #Foke,"[""Foke""]",[],1475058376000.0,2016-09-28 10:26:16
1039581360.0,0.0,False,0.0,Foke 9/11 families WILL be able to sue Saudi Arabia for billions after Senate and House override Obama'... https://t.co/TSdqaRoDno #Foke,"[""Foke""]",[],1475120991000.0,2016-09-29 03:49:51
1039581360.0,0.0,False,0.0,Foke Barack Obama welcomes Olympic heroes to the White House https://t.co/CExmrT3u8I #Foke,"[""Foke""]",[],1475230990000.0,2016-09-30 10:23:10
1039581360.0,0.0,False,0.0,Foke Hillary Clinton chokes up at rally minutes before she's aided down set of stairs https://t.co/SeYLlCPoXQ #Foke,"[""Foke""]",[],1475290394000.0,2016-10-01 02:53:14
1039581360.0,0.0,False,0.0,Foke President Obama and former Shimon Peres's son during funeral captured in moment of compassion https://t.co/LawOF452Sr #Foke,"[""Foke""]",[],1475354599000.0,2016-10-01 20:43:19
1039581360.0,0.0,False,0.0,Foke Donald Trump 'could have avoided paying taxes for almost two decades after he declared a loss of a... https://t.co/q4OiHgP14f #Foke,"[""Foke""]",[],1475391957000.0,2016-10-02 07:05:57
1039581360.0,0.0,False,0.0,Foke Anti-Tory protesters demand Theresa May calls an early election immediately - but have they seen t... https://t.co/QqWBKpbtbd #Foke,"[""Foke""]",[],1475417094000.0,2016-10-02 14:04:54
1039581360.0,0.0,False,0.0,Foke Twitter mocks the 'last time Donald Trump paid taxes' with '90s references https://t.co/pEPQ63q1P6 #Foke,"[""Foke""]",[],1475486866000.0,2016-10-03 09:27:46
1039581360.0,0.0,False,0.0,Foke Is this the moment that will tank Hillary's campaign? Julian Assange is set to speak at WikiLeaks ... https://t.co/cm1X0hzFho #Foke,"[""Foke""]",[],1475572402000.0,2016-10-04 09:13:22
1039581360.0,0.0,False,0.0,Foke Vice Presidential debate sees Tim Kaine go all out attack on Trump https://t.co/3IP8aJAMC9 #Foke,"[""Foke""]",[],1475638754000.0,2016-10-05 03:39:14
1039581360.0,0.0,False,0.0,Foke Donald Trump is the new Frankie Howerd writes Craig Brown https://t.co/USuygi6AXD #Foke,"[""Foke""]",[],1475719820000.0,2016-10-06 02:10:20
1039581360.0,0.0,False,0.0,Foke Prankster reporter horrifies New Yorkers by announcing Hillary Clinton has ZIKA https://t.co/vlLroBVwCQ #Foke,"[""Foke""]",[],1475731968000.0,2016-10-06 05:32:48
1039581360.0,0.0,False,0.0,Foke 'You can do anything. Grab them by the p***y': Donald Trump recorded in lewd hot mic chat with Bil... https://t.co/1C8rNuSpjT #Foke,"[""Foke""]",[],1475877272000.0,2016-10-07 21:54:32
1039581360.0,0.0,False,0.0,Foke Tom Bergeron and Lena Dunham lead celebrity outrage at Donald Trump's lewd comments https://t.co/76fuXAo4NS #Foke,"[""Foke""]",[],1475890712000.0,2016-10-08 01:38:32
1039581360.0,0.0,False,0.0,Foke Wikileaks release transcripts of Hillary Clinton's closed-doors Wall Street speeches https://t.co/hq0pkB545l #Foke,"[""Foke""]",[],1475915147000.0,2016-10-08 08:25:47
1039581360.0,0.0,False,0.0,Foke Hillary Clinton's campaign wanted to elevate Donald Trump and other 'extreme' Republicans https://t.co/aKcJ1yBcey #Foke,"[""Foke""]",[],1475988277000.0,2016-10-09 04:44:37
1039581360.0,0.0,False,0.0,"Foke 'It's just alpha male boasting, it's the kind of thing men do': Nigel Farage DEFENDS Donald Trump ... https://t.co/0aXF2co0OZ #Foke","[""Foke""]",[],1476029783000.0,2016-10-09 16:16:23
1039581360.0,0.0,False,0.0,Foke Defiant Trump admits Republican 'leadership' are turning their backs on him but thanks fans for th... https://t.co/LXDxjQq4K2 #Foke,"[""Foke""]",[],1476029783000.0,2016-10-09 16:16:23
1039581360.0,0.0,False,0.0,Foke Second Presidential Debate: Trump’s all-out attack on the Clintons for their sexual past https://t.co/jC8EtHB5Xu #Foke,"[""Foke""]",[],1476080099000.0,2016-10-10 06:14:59
1039581360.0,0.0,False,0.0,Foke Hillary Clinton scores decisive win against Donald Trump in first snap polls https://t.co/ha6m9wJm16 #Foke,"[""Foke""]",[],1476094634000.0,2016-10-10 10:17:14
1039581360.0,0.0,False,0.0,Foke Warren Buffett hits back at Donald Trump's claim he got 'massive deduction' by saying he has 'paid... https://t.co/ckNlgAaf0Q #Foke,"[""Foke""]",[],1476132749000.0,2016-10-10 20:52:29
1039581360.0,0.0,False,0.0,Foke PIERS MORGAN: The night Bill Clinton and his loose zipper let Trump dodge the bullet https://t.co/cLoqZ5uioR #Foke,"[""Foke""]",[],1476138722000.0,2016-10-10 22:32:02
1039581360.0,0.0,False,0.0,Foke Obama vows to send people to Mars by the 2030s https://t.co/Q0opbfhrqi #Foke,"[""Foke""]",[],1476196645000.0,2016-10-11 14:37:25
1039581360.0,0.0,False,0.0,Foke Rod Stewart says his 'friend' Donald Trump 'isn't made to be president' https://t.co/MVm73jz3yl #Foke,"[""Foke""]",[],1476278956000.0,2016-10-12 13:29:16
1039581360.0,0.0,False,0.0,Foke BBC Today presenter Justin Webb is taken to task by listeners who say he defended Donald Trump's '... https://t.co/Huo1QfHzRo #Foke,"[""Foke""]",[],1476283877000.0,2016-10-12 14:51:17
1039581360.0,0.0,False,0.0,Foke Four women claim Donald Trump 'touched them inappropriately'   https://t.co/ipnediJQV5 #Foke,"[""Foke""]",[],1476320768000.0,2016-10-13 01:06:08
1039581360.0,0.0,False,0.0,Foke Michelle Obama blasts Trump for 'sexually assaulting women' https://t.co/BeFmYJ6nTS #Foke,"[""Foke""]",[],1476402509000.0,2016-10-13 23:48:29
1039581360.0,0.0,False,0.0,Foke One of the woman to accuse Donald Trump speaks to CNN's Anderson Cooper https://t.co/7I9FuEppTd #Foke,"[""Foke""]",[],1476419687000.0,2016-10-14 04:34:47
1039581360.0,0.0,False,0.0,Foke Trump 'made women walk on restaurant table to see whether they were wearing underwear' https://t.co/a44TzovAgo #Foke,"[""Foke""]",[],1476419688000.0,2016-10-14 04:34:48
1039581360.0,0.0,False,0.0,Foke Donald Trump called Khloe Kardashian 'ugly' on Celebrity Apprentice claim sources https://t.co/BCF3NurGKo #Foke,"[""Foke""]",[],1476485360000.0,2016-10-14 22:49:20
1039581360.0,0.0,False,0.0,Foke Apprentice contestant tearfully claims Donald Trump groped and kissed her against her will at the ... https://t.co/Y26ACef3cG #Foke,"[""Foke""]",[],1476485361000.0,2016-10-14 22:49:21
1039581360.0,0.0,False,0.0,Foke Trump laughs in agreement at 'sexual predator' label on Howard Stern's radio show https://t.co/9j67oyfMjV #Foke,"[""Foke""]",[],1476493585000.0,2016-10-15 01:06:25
1039581360.0,0.0,False,0.0,Foke Trump defended from groping allegations by Anthony Gilberthorpe https://t.co/l1UDz4VPjm #Foke,"[""Foke""]",[],1476503732000.0,2016-10-15 03:55:32
1039581360.0,0.0,False,0.0,Foke Photographer tells how 'distinctive looking' Donald Trump put his hand up her miniskirt and 'touch... https://t.co/uodtiwlj7x #Foke,"[""Foke""]",[],1476503732000.0,2016-10-15 03:55:32
1039581360.0,0.0,False,0.0,Foke Trump ridicules accusers and warns Obama could be targeted by false allegations https://t.co/xPobc7l1sR #Foke,"[""Foke""]",[],1476503732000.0,2016-10-15 03:55:32
1039581360.0,0.0,False,0.0,Foke Trump's mother was a penniless Scots girl who arrived in America barefoot https://t.co/ipF9wObXGX #Foke,"[""Foke""]",[],1476546175000.0,2016-10-15 15:42:55
1039581360.0,0.0,False,0.0,Foke Paula Jones says she fears for her life if Hillary Clinton is elected president https://t.co/5vWoew0tsA #Foke,"[""Foke""]",[],1476546176000.0,2016-10-15 15:42:56
1039581360.0,0.0,False,0.0,"Foke Donald Trump stokes fears of a 'rigged election', battling the sexual assault allegations by eight... https://t.co/dj9mEyP65n #Foke","[""Foke""]",[],1476552089000.0,2016-10-15 17:21:29
1039581360.0,0.0,False,0.0,Foke Pro-Trump sheriff issues Twitter call to arms to fight 'corrupt' media and White House https://t.co/JnPRswIYQZ #Foke,"[""Foke""]",[],1476587774000.0,2016-10-16 03:16:14
1039581360.0,0.0,False,0.0,Foke Donald Trump hits out at Alec Baldwin and claims SNL is part of media conspiracy https://t.co/bbfAcKiNKj #Foke,"[""Foke""]",[],1476642551000.0,2016-10-16 18:29:11
1039581360.0,0.0,False,0.0,Foke Clinton insider's cutting description of Chelsea revealed in latest Wikileaks offload https://t.co/7DdVGKXcoj #Foke,"[""Foke""]",[],1476689347000.0,2016-10-17 07:29:07
1039581360.0,0.0,False,0.0,Foke Two hundred walk out of Amy Schumer's Tampa show after Trump tear https://t.co/HUThDxfXeo #Foke,"[""Foke""]",[],1476741173000.0,2016-10-17 21:52:53
1039581360.0,0.0,False,0.0,Foke Donald Trump goes to kiss a young girl only for her to push him away https://t.co/X3oIfSA9Qy #Foke,"[""Foke""]",[],1476842300000.0,2016-10-19 01:58:20
1039581360.0,0.0,False,0.0,Foke Michael Sandford planned to gun down Donald Trump at a Las Vegas rally https://t.co/uwwdjHu42F #Foke,"[""Foke""]",[],1476911920000.0,2016-10-19 21:18:40
1039581360.0,0.0,False,0.0,Foke PIERS MORGAN begs Trump to accept the result of the election https://t.co/0eq4mANbBb #Foke,"[""Foke""]",[],1477011374000.0,2016-10-21 00:56:14
1039581360.0,0.0,False,0.0,Foke Salma Hayek claims Donald Trump asked her out repeatedly while she had a boyfriend https://t.co/fYQ9uAAAQL #Foke,"[""Foke""]",[],1477110608000.0,2016-10-22 04:30:08
1039581360.0,0.0,False,0.0,Foke Richard Branson recounts a vindictive Trump at 'bizarre' lunch meeting in Manhattan https://t.co/ZOYhqq5UOM #Foke,"[""Foke""]",[],1477110609000.0,2016-10-22 04:30:09
1039581360.0,0.0,False,0.0,Foke Donald Trump Jr. says dad's comments about sexually harassing women are typical among men https://t.co/QCupyYHiTX #Foke,"[""Foke""]",[],1477150122000.0,2016-10-22 15:28:42
1039581360.0,0.0,False,0.0,Foke Donald Trump vows to take legal action against every woman who's accused him of sexual misconduct https://t.co/dYUftBADyI #Foke,"[""Foke""]",[],1477175827000.0,2016-10-22 22:37:07
1039581360.0,0.0,False,0.0,Foke Tom Hanks dons Make America Great Again cap to mock Trump supporters in SNL skit  https://t.co/CHXI3H4YUp #Foke,"[""Foke""]",[],1477259539000.0,2016-10-23 21:52:19
1039581360.0,0.0,False,0.0,Foke Eric Trump says his dad will '100 per cent' accept election results if they are fair https://t.co/B0YOXmxgfw #Foke,"[""Foke""]",[],1477264493000.0,2016-10-23 23:14:53
1039581360.0,0.0,False,0.0,Foke Republican strategist Karl Rove says Trump is bound to lose the election https://t.co/6NkAs0Yjyx #Foke,"[""Foke""]",[],1477280391000.0,2016-10-24 03:39:51
1039581360.0,0.0,False,0.0,Foke Justin Timberlake could face 30 days in jail for US election voting booth seflie https://t.co/dimGJ1xlS8 #Foke,"[""Foke""]",[],1477434584000.0,2016-10-25 22:29:44
1039581360.0,0.0,False,0.0,Foke Clinton's aides planned to joke about Obama being born in Kenya to deal with email scandal https://t.co/bkD3PVggUl #Foke,"[""Foke""]",[],1477434585000.0,2016-10-25 22:29:45
1039581360.0,0.0,False,0.0,Foke Photographer Alison Jackson sets up spoof Trump campaign rally in NYC https://t.co/PRWjBDVvHE #Foke,"[""Foke""]",[],1477459801000.0,2016-10-26 05:30:01
1039581360.0,0.0,False,0.0,"Foke Bill Clinton's long-time lover reveals how he called ruthless Hillary 'The Warden', bemoaned his s... https://t.co/R20C6t4cyW #Foke","[""Foke""]",[],1477504487000.0,2016-10-26 17:54:47
1039581360.0,0.0,False,0.0,Foke Hillary Clinton goes to war with FBI director demanding it explains new email probe https://t.co/wQSBk86q2A #Foke,"[""Foke""]",[],1477706483000.0,2016-10-29 02:01:23
1039581360.0,0.0,False,0.0,Foke Huma Abedin's loyalty to Anthony Weiner could help Hillary Clinton win US election https://t.co/mSQhIVNeJF #Foke,"[""Foke""]",[],1477718881000.0,2016-10-29 05:28:01
1039581360.0,0.0,False,0.0,Foke Huma lies low as Hillary's attack dogs turn on Comey: Clinton's aide nowhere to be seen on campaig... https://t.co/TG2v7vbZZu #Foke,"[""Foke""]",[],1477766466000.0,2016-10-29 18:41:06
1039581360.0,0.0,False,0.0,Foke It's all her fault: Jubilant Trump says Hillary 'has nobody to blame but herself for her mounting ... https://t.co/V4uVyUU3wL #Foke,"[""Foke""]",[],1477770829000.0,2016-10-29 19:53:49
1039581360.0,0.0,False,0.0,Foke Trump wipes out Clinton's seven point lead as she loses steam in polls carried out BEFORE the FBI ... https://t.co/lykSgE1PiV #Foke,"[""Foke""]",[],1477799799000.0,2016-10-30 03:56:39
1039581360.0,0.0,False,0.0,Foke Huma Abedin holed up at her New York home the day after FBI reopens case against Clinton https://t.co/qbDgDnFHD2 #Foke,"[""Foke""]",[],1477837702000.0,2016-10-30 14:28:22
1039581360.0,0.0,False,0.0,Foke Hillary Clinton with JLo endorsement concert in Florida https://t.co/EaxL8sIzTC #Foke,"[""Foke""]",[],1477842302000.0,2016-10-30 15:45:02
1039581360.0,0.0,False,0.0,Foke Why FBI Director Comey jumped at chance to reopen Hillary Clinton email investigation https://t.co/LCHVmLdZqO #Foke,"[""Foke""]",[],1477851862000.0,2016-10-30 18:24:22
1039581360.0,0.0,False,0.0,"Foke Hillary's nightmare scenario: Weiner's laptop holds 650,000 emails, thousands of them from Clinton... https://t.co/m6EQ6uW7H6 #Foke","[""Foke""]",[],1477865237000.0,2016-10-30 22:07:17
1039581360.0,0.0,False,0.0,Foke US election polls show Hillary Clinton's 12 point lead shrinks down to just ONE POINT https://t.co/Xqw3EfKOK2 #Foke,"[""Foke""]",[],1477869681000.0,2016-10-30 23:21:21
1039581360.0,0.0,False,0.0,Foke Senate Minority Leader Harry Reid attempts to deflect the heat on Hillary Clinton https://t.co/dXa8KIpyoz #Foke,"[""Foke""]",[],1477913363000.0,2016-10-31 11:29:23
1039581360.0,0.0,False,0.0,"Foke PIERS MORGAN: Huma Abedin, Hillary and Bill Clinton ONLY people to blame over email scandal https://t.co/iPbg6H72VH #Foke","[""Foke""]",[],1477943042000.0,2016-10-31 19:44:02
1039581360.0,0.0,False,0.0,Foke David Walliams dresses as Trump for Jonathan Ross' Halloween bash https://t.co/HeJiBMVCq8 #Foke,"[""Foke""]",[],1477986642000.0,2016-11-01 07:50:42
